filer_cik10,accession_nodash,exhibit_file,path,matched_phrase,money_in_window,snippet
1384905,000119312521324526,d440055dex102.htm,sec_cache_light_fix/CIK1384905/000119312521324526/d440055dex102.htm,Purchase Price,"$1,000|$200,000,000","rap"">two-hundred</FONT> thousand (200,000) shares of Series A Preferred Stock (the &#147;<U>Preferred Shares</U>&#148;) for a purchase price per Preferred Share equal to <FONT STYLE=""white-space:nowrap"">one-thousand</FONT> dollars ($1,000). The aggregate purchase price of the Preferred Shares shall be <FONT STYLE=""white-space:nowrap"">two-hundred</FONT> million dollars ($200,000,000) (the &#147;<U>Purchase Price</U>&#148;), payable by the Investor against delivery of the Preferred Shares at the Closing, in accordance with <U>Section</U><U></U><U>&nbsp;2.02</U>. </P> <P STYLE=""margin-top:12pt; margin-bottom:0pt; text-indent:4%; font-size:10pt; font-family:Times New Roman"">SECTION&nbsp;2.02. <U"
1384905,000119312519261770,d813527dex101.htm,sec_cache_light_fix/CIK1384905/000119312519261770/d813527dex101.htm,purchase price,"$1,000|$125,000,000","10pt; font-family:Times New Roman"">SECTION 2.01.&nbsp;<U>Purchase and Sale</U>. On the terms and subject to the conditions set forth in this Agreement, the Investor shall purchase and acquire from the Company an aggregate of 125,000 shares of Series A Preferred Stock (the &#147;<U>Preferred Shares</U>&#148;), and the Company shall issue, sell and deliver to the Investor the Preferred Shares for a purchase price per Preferred Share equal to $1,000. The aggregate purchase price of the Preferred Shares shall be $125,000,000 (the &#147;<U>Purchase Price</U>&#148;). The purchase of the Preferred Shares pursuant to this <U>Section</U><U></U><U>&nbsp;2.01</U> is referred to as the &#147;<U>Purchase"
1384905,000119312519261770,d813527dex101.htm,sec_cache_light_fix/CIK1384905/000119312519261770/d813527dex101.htm,purchase price,"$1,000|$125,000,000","and Sale</U>. On the terms and subject to the conditions set forth in this Agreement, the Investor shall purchase and acquire from the Company an aggregate of 125,000 shares of Series A Preferred Stock (the &#147;<U>Preferred Shares</U>&#148;), and the Company shall issue, sell and deliver to the Investor the Preferred Shares for a purchase price per Preferred Share equal to $1,000. The aggregate purchase price of the Preferred Shares shall be $125,000,000 (the &#147;<U>Purchase Price</U>&#148;). The purchase of the Preferred Shares pursuant to this <U>Section</U><U></U><U>&nbsp;2.01</U> is referred to as the &#147;<U>Purchase</U>&#148;. </P> <P STYLE=""margin-top:18pt; margin-bottom:0pt; tex"
1384905,000119312519261770,d813527dex101.htm,sec_cache_light_fix/CIK1384905/000119312519261770/d813527dex101.htm,Purchase Price,"$1,000|$125,000,000","Agreement, the Investor shall purchase and acquire from the Company an aggregate of 125,000 shares of Series A Preferred Stock (the &#147;<U>Preferred Shares</U>&#148;), and the Company shall issue, sell and deliver to the Investor the Preferred Shares for a purchase price per Preferred Share equal to $1,000. The aggregate purchase price of the Preferred Shares shall be $125,000,000 (the &#147;<U>Purchase Price</U>&#148;). The purchase of the Preferred Shares pursuant to this <U>Section</U><U></U><U>&nbsp;2.01</U> is referred to as the &#147;<U>Purchase</U>&#148;. </P> <P STYLE=""margin-top:18pt; margin-bottom:0pt; text-indent:4%; font-size:10pt; font-family:Times New Roman"">SECTION 2.02.&nbs"
874015,000104746902003818,a2094332zex-10_3.htm,sec_cache_light_fix/CIK874015/000104746902003818/a2094332zex-10_3.htm,purchase price,"$2,985,000|$12,015,000","k and (ii)&nbsp;Isis of 9,612 shares of Common Stock, issuable as provided in Clause&nbsp;4.3 hereof </FONT></P> <P><FONT SIZE=2>&nbsp;&nbsp;&nbsp;&nbsp;&nbsp;&nbsp;&nbsp;&nbsp;4.2&nbsp;&nbsp;On the Original Effective Date, Orasense issued and sold to EIS, and EIS purchased from Orasense, upon the terms and subject to the conditions set forth herein, 2,388 shares of Common Stock for an aggregate purchase price of $2,985,000. Orasense issued and sold to Isis, and Isis purchased from Orasense, upon the terms and conditions set forth herein, 9,612 shares of Common Stock for an aggregate purchase price of $12,015,000. </FONT></P> <P><FONT SIZE=2>&nbsp;&nbsp;&nbsp;&nbsp;&nbsp;&nbsp;&nbsp;&nbsp;4."
874015,000104746902003818,a2094332zex-10_3.htm,sec_cache_light_fix/CIK874015/000104746902003818/a2094332zex-10_3.htm,purchase price,"$2,985,000|$12,015,000",";On the Original Effective Date, Orasense issued and sold to EIS, and EIS purchased from Orasense, upon the terms and subject to the conditions set forth herein, 2,388 shares of Common Stock for an aggregate purchase price of $2,985,000. Orasense issued and sold to Isis, and Isis purchased from Orasense, upon the terms and conditions set forth herein, 9,612 shares of Common Stock for an aggregate purchase price of $12,015,000. </FONT></P> <P><FONT SIZE=2>&nbsp;&nbsp;&nbsp;&nbsp;&nbsp;&nbsp;&nbsp;&nbsp;4.3&nbsp;&nbsp;[***] The parties agree that they will take all action reasonably necessary, including amending the Orasense Memorandum of Association and Bye-Laws to increase the number of shar"
866374,000086637419000013,flex-927201910xq.htm,sec_cache_light_fix/CIK866374/000086637419000013/flex-927201910xq.htm,purchase price,$1.8|$72,"ize:10pt;""> during the </span><span style=""font-family:inherit;font-size:10pt;"">six</span><span style=""font-family:inherit;font-size:10pt;"">-month period ended </span><span style=""font-family:inherit;font-size:10pt;"">September&#160;27, 2019</span><span style=""font-family:inherit;font-size:10pt;"">, primarily driven by cash outflows related to accounts receivable. Cash collections from the deferred purchase price on our ABS sales program of </span><span style=""font-family:inherit;font-size:10pt;"">$1.8 billion</span><span style=""font-family:inherit;font-size:10pt;""> are now included in cash from investing activities. This was coupled with </span><span style=""font-family:inherit;font-size:10pt;"""
866374,000086637419000013,flex-927201910xq.htm,sec_cache_light_fix/CIK866374/000086637419000013/flex-927201910xq.htm,purchase price,$1.8,"an><span style=""font-family:inherit;font-size:10pt;"">-month period ended </span><span style=""font-family:inherit;font-size:10pt;"">September&#160;27, 2019</span><span style=""font-family:inherit;font-size:10pt;"">. This was primarily driven by </span><span style=""font-family:inherit;font-size:10pt;"">$1.8 billion</span><span style=""font-family:inherit;font-size:10pt;""> of cash collections on deferred purchase price from our ABS programs during the </span><span style=""font-family:inherit;font-size:10pt;"">six</span><span style=""font-family:inherit;font-size:10pt;"">-month period ended </span><span style=""font-family:inherit;font-size:10pt;"">September&#160;27, 2019</span><span style=""font-family:inh"
866374,000086637419000013,flex-927201910xq.htm,sec_cache_light_fix/CIK866374/000086637419000013/flex-927201910xq.htm,purchase price,$357|$293,"support to the financial institutions and is recorded at its estimated fair value. As of </span><span style=""font-family:inherit;font-size:10pt;"">September&#160;27, 2019</span><span style=""font-family:inherit;font-size:10pt;"">, and </span><span style=""font-family:inherit;font-size:10pt;"">March&#160;31, 2019</span><span style=""font-family:inherit;font-size:10pt;"">, the fair values of our deferred purchase price receivable were approximately </span><span style=""font-family:inherit;font-size:10pt;"">$357 million</span><span style=""font-family:inherit;font-size:10pt;""> and </span><span style=""font-family:inherit;font-size:10pt;"">$293 million</span><span style=""font-family:inherit;font-size:10pt;"""
866374,000086637419000010,flex-628201910xq.htm,sec_cache_light_fix/CIK866374/000086637419000010/flex-628201910xq.htm,purchase price,$0.9|$45|$192,"t-size:10pt;""> during the </span><span style=""font-family:inherit;font-size:10pt;"">three</span><span style=""font-family:inherit;font-size:10pt;"">-month period ended </span><span style=""font-family:inherit;font-size:10pt;"">June&#160;28, 2019</span><span style=""font-family:inherit;font-size:10pt;"">, primarily driven by cash outflows related to accounts receivable. Cash collections from the deferred purchase price on our ABS sales program of $0.9 billion are now included in cash from investing activities. This was partially offset by </span><span style=""font-family:inherit;font-size:10pt;"">$45 million</span><span style=""font-family:inherit;font-size:10pt;""> of net income for the period plus </s"
866374,000086637419000010,flex-628201910xq.htm,sec_cache_light_fix/CIK866374/000086637419000010/flex-628201910xq.htm,purchase price,$0.9,"e</span><span style=""font-family:inherit;font-size:10pt;"">-month period ended </span><span style=""font-family:inherit;font-size:10pt;"">June&#160;28, 2019</span><span style=""font-family:inherit;font-size:10pt;"">. This was primarily driven by </span><span style=""font-family:inherit;font-size:10pt;"">$0.9 billion</span><span style=""font-family:inherit;font-size:10pt;""> of cash collections on deferred purchase price from our ABS programs during the </span><span style=""font-family:inherit;font-size:10pt;"">three</span><span style=""font-family:inherit;font-size:10pt;"">-month period ended </span><span style=""font-family:inherit;font-size:10pt;"">June&#160;28, 2019</span><span style=""font-family:inheri"
866374,000086637419000010,flex-628201910xq.htm,sec_cache_light_fix/CIK866374/000086637419000010/flex-628201910xq.htm,purchase price,$335|$293,"redit support to the financial institutions and is recorded at its estimated fair value. As of </span><span style=""font-family:inherit;font-size:10pt;"">June&#160;28, 2019</span><span style=""font-family:inherit;font-size:10pt;"">, and </span><span style=""font-family:inherit;font-size:10pt;"">March&#160;31, 2019</span><span style=""font-family:inherit;font-size:10pt;"">, the fair values of our deferred purchase price receivable were approximately </span><span style=""font-family:inherit;font-size:10pt;"">$335 million</span><span style=""font-family:inherit;font-size:10pt;""> and $293 million, respectively. As of </span><span style=""font-family:inherit;font-size:10pt;"">June&#160;28, 2019</span><span st"
18230,000001823015000061,cat_exx13x12312014.htm,sec_cache_light_fix/CIK18230/000001823015000061/cat_exx13x12312014.htm,purchase price,$9|$169,"n, Berg has designed and manufactured heavy-duty marine thrusters and controllable pitch propellers since 1929. Its proprietary systems are employed in maritime applications throughout the world that require precise maneuvering and positioning. With the acquisition, Caterpillar will transition from selling only engines and generators to providing complete marine propulsion package systems. The purchase price, net of </font><font style=""font-family:inherit;font-size:10pt;"">$9 million</font><font style=""font-family:inherit;font-size:10pt;"">&#32;of acquired cash, was approximately </font><font style=""font-family:inherit;font-size:10pt;"">$169 million</font><font style=""font-family:inherit;font-s"
18230,000001823015000061,cat_exx13x12312014.htm,sec_cache_light_fix/CIK18230/000001823015000061/cat_exx13x12312014.htm,purchase price,$9|$169|$7,"s and generators to providing complete marine propulsion package systems. The purchase price, net of </font><font style=""font-family:inherit;font-size:10pt;"">$9 million</font><font style=""font-family:inherit;font-size:10pt;"">&#32;of acquired cash, was approximately </font><font style=""font-family:inherit;font-size:10pt;"">$169 million</font><font style=""font-family:inherit;font-size:10pt;"">. The purchase price includes contingent consideration, payable in 2016, with a fair value of approximately </font><font style=""font-family:inherit;font-size:10pt;"">$7 million</font><font style=""font-family:inherit;font-size:10pt;"">. The contingent consideration will be based on the revenues achieved by Ber"
18230,000001823015000061,cat_exx13x12312014.htm,sec_cache_light_fix/CIK18230/000001823015000061/cat_exx13x12312014.htm,purchase price,$677|$444,"t-size:10pt;""><br></font></div><div style=""line-height:120%;font-size:10pt;""><font style=""font-family:inherit;font-size:10pt;""><br></font></div><div style=""line-height:120%;font-size:10pt;""><font style=""font-family:inherit;font-size:10pt;""><br></font></div></div><br><div style=""line-height:120%;text-align:justify;padding-left:24px;font-size:10pt;""><font style=""font-family:inherit;font-size:10pt;"">purchase price of approximately </font><font style=""font-family:Times New Roman;font-size:10pt;color:#000000;text-decoration:none;"">$677 million</font><font style=""font-family:inherit;font-size:10pt;"">&#32;was comprised of net cash paid of approximately </font><font style=""font-family:Times New Roma"
18230,000001823015000061,cat_exx13x12312014.htm,sec_cache_light_fix/CIK18230/000001823015000061/cat_exx13x12312014.htm,purchase price,$82,"rofit and improper revenue recognition practices involving early and, at times unsupported, revenue recognition. Due to the identified accounting misconduct that occurred before the acquisition, measurement period adjustments were made to the fair value of the acquired assets and assumed liabilities during the fourth quarter of 2012. The fair values presented above are a final allocation of the purchase price and reflect these changes, which are primarily comprised of a decrease in finite-lived intangible assets of </font><font style=""font-family:Times New Roman;font-size:10pt;color:#000000;text-decoration:none;"">$82 million</font><font style=""font-family:inherit;font-size:10pt;"">, a decreas"
18230,000001823015000061,cat_exx13x12312014.htm,sec_cache_light_fix/CIK18230/000001823015000061/cat_exx13x12312014.htm,purchase price,$18|$206,"yle=""font-family:inherit;font-size:10pt;color:#000000;text-decoration:none;"">100 percent</font><font style=""font-family:inherit;font-size:10pt;"">&#32;of the stock of Caterpillar Tohoku Ltd. (Cat Tohoku). Cat Tohoku was an independently owned and operated dealership providing sales, rental, service and after market support for Caterpillar machines and engines in the northeastern part of Japan. The purchase price, net of </font><font style=""font-family:inherit;font-size:10pt;color:#000000;text-decoration:none;"">$18 million</font><font style=""font-family:inherit;font-size:10pt;"">&#32;of acquired cash, was approximately </font><font style=""font-family:inherit;font-size:10pt;color:#000000;text-de"
18230,000001823015000061,cat_exx13x12312014.htm,sec_cache_light_fix/CIK18230/000001823015000061/cat_exx13x12312014.htm,purchase price,$18|$206|$77|$64,"pan. The purchase price, net of </font><font style=""font-family:inherit;font-size:10pt;color:#000000;text-decoration:none;"">$18 million</font><font style=""font-family:inherit;font-size:10pt;"">&#32;of acquired cash, was approximately </font><font style=""font-family:inherit;font-size:10pt;color:#000000;text-decoration:none;"">$206 million</font><font style=""font-family:inherit;font-size:10pt;"">. The purchase price included the assumption of </font><font style=""font-family:inherit;font-size:10pt;color:#000000;text-decoration:none;"">$77 million</font><font style=""font-family:inherit;font-size:10pt;"">&#32;in third-party debt, as well as </font><font style=""font-family:inherit;font-size:10pt;color:"
18230,000001823015000061,cat_exx13x12312014.htm,sec_cache_light_fix/CIK18230/000001823015000061/cat_exx13x12312014.htm,purchase price,$567|$567|$107,"erit;font-size:10pt;"">&#32;equity interest in Caterpillar Logistics Services LLC, the third party logistics division of our wholly owned subsidiary, Caterpillar Logistics Inc., for </font><font style=""font-family:inherit;font-size:10pt;color:#000000;text-decoration:none;"">$567 million</font><font style=""font-family:inherit;font-size:10pt;"">&#32;subject to certain working capital adjustments. The purchase price of </font><font style=""font-family:inherit;font-size:10pt;color:#000000;text-decoration:none;"">$567 million</font><font style=""font-family:inherit;font-size:10pt;"">&#32;was comprised of a </font><font style=""font-family:inherit;font-size:10pt;color:#000000;text-decoration:none;"">$107 m"
18230,000001823015000061,cat_exx13x12312014.htm,sec_cache_light_fix/CIK18230/000001823015000061/cat_exx13x12312014.htm,purchase price,$82,"rofit and improper revenue recognition practices involving early and, at times unsupported, revenue recognition. Due to the identified accounting misconduct that occurred before the acquisition, measurement period adjustments were made to the fair value of the acquired assets and assumed liabilities during the fourth quarter of 2012. The fair values presented above are a final allocation of the purchase price and reflect these changes, which are primarily comprised of a decrease in finite-lived intangible assets of </font><font style=""font-family:Times New Roman;font-size:10pt;color:#000000;text-decoration:none;"">$82 million</font><font style=""font-family:inherit;font-size:10pt;"">, a decreas"
18230,000001823015000061,cat_exx13x12312014.htm,sec_cache_light_fix/CIK18230/000001823015000061/cat_exx13x12312014.htm,purchase price,$567|$567|$107,"erit;font-size:10pt;"">&#32;equity interest in Caterpillar Logistics Services LLC, the third party logistics division of our wholly owned subsidiary, Caterpillar Logistics Inc., for </font><font style=""font-family:inherit;font-size:10pt;color:#000000;text-decoration:none;"">$567 million</font><font style=""font-family:inherit;font-size:10pt;"">&#32;subject to certain working capital adjustments. The purchase price of </font><font style=""font-family:inherit;font-size:10pt;color:#000000;text-decoration:none;"">$567 million</font><font style=""font-family:inherit;font-size:10pt;"">&#32;was comprised of a </font><font style=""font-family:inherit;font-size:10pt;color:#000000;text-decoration:none;"">$107 m"
200406,000020040613000038,ex13-form10xk20121230.htm,sec_cache_light_fix/CIK200406/000020040613000038/ex13-form10xk20121230.htm,purchase price,"$15,785","0;&#160;&#160;&#160;&#160;&#160;&#160;&#160;&#160;&#160;&#160;&#160;&#160;</font></div></div><hr style=""page-break-after:always""><div><div style=""line-height:120%;font-size:10pt;""><font style=""font-family:inherit;font-size:10pt;""><br></font></div></div><br><div style=""line-height:120%;text-align:left;text-indent:24px;font-size:10pt;""><font style=""font-family:inherit;font-size:10pt;"">The excess of purchase price over the estimated fair value of tangible assets acquired amounted to </font><font style=""font-family:inherit;font-size:10pt;color:#000000;text-decoration:none;"">$15,785 million</font><font style=""font-family:inherit;font-size:10pt;"">&#32;and has been assigned to identifiable intangib"
200406,000020040613000038,ex13-form10xk20121230.htm,sec_cache_light_fix/CIK200406/000020040613000038/ex13-form10xk20121230.htm,purchase price,20.2 billion|17.5 billion,"#000000;text-decoration:none;"">25%</font><font style=""font-family:inherit;font-size:10pt;"">&#32;rate.</font></div><div style=""line-height:120%;text-align:left;text-indent:24px;font-size:10pt;""><font style=""font-family:inherit;font-size:10pt;"">During the fiscal second quarter, the Company completed the acquisition of Synthes, Inc., a global developer and manufacturer of orthopaedics devices, for a purchase price of $</font><font style=""font-family:inherit;font-size:10pt;color:#000000;text-decoration:none;"">20.2 billion</font><font style=""font-family:inherit;font-size:10pt;"">&#32;in cash and stock. The net acquisition cost of the transaction is $</font><font style=""font-family:inherit;font-siz"
200406,000020040613000038,ex13-form10xk20121230.htm,sec_cache_light_fix/CIK200406/000020040613000038/ex13-form10xk20121230.htm,purchase price,203.7 million|12.9 billion,"wo banks, pursuant to two accelerated share repurchase (ASR) agreements dated June 12, 2012. On June 13, 2012, Janssen Pharmaceutical purchased an aggregate of approximately </font><font style=""font-family:inherit;font-size:10pt;color:#000000;text-decoration:none;"">203.7 million</font><font style=""font-family:inherit;font-size:10pt;"">&#32;shares of Johnson &amp; Johnson common stock at an initial purchase price of $</font><font style=""font-family:inherit;font-size:10pt;color:#000000;text-decoration:none;"">12.9 billion</font><font style=""font-family:inherit;font-size:10pt;"">&#32;under the ASR agreements, with all of the shares delivered to Janssen Pharmaceutical on June 13, 2012.&#160;&#160;F"
200406,000020040613000038,ex13-form10xk20121230.htm,sec_cache_light_fix/CIK200406/000020040613000038/ex13-form10xk20121230.htm,purchase price,$65.45,"ration:none;"">$65.45</font><font style=""font-family:inherit;font-size:9pt;"">&#32;per share. </font></div><div style=""line-height:120%;text-align:left;font-size:10pt;""><font style=""font-family:inherit;font-size:10pt;""><br></font></div><div style=""line-height:120%;text-align:left;font-size:10pt;""><font style=""font-family:inherit;font-size:10pt;"">The Company is still finalizing the allocation of the purchase price to the individual assets acquired and liabilities assumed. The allocation of the purchase price included in the current period balance sheet is based on the best estimate of management. To assist management in the allocation, the Company engaged valuation specialists to prepare indepe"
200406,000020040613000038,ex13-form10xk20121230.htm,sec_cache_light_fix/CIK200406/000020040613000038/ex13-form10xk20121230.htm,purchase price,"$2,657","s; full ownership of the Johnson &amp; Johnson-Merck Consumer Pharmaceuticals Co. joint venture in the U.S. from Merck Sharp &amp; Dohme Corp; and SterilMed, Inc., a leader in the reprocessing and re-manufacturing of medical devices in the U.S.</font></div><div style=""line-height:120%;text-align:left;text-indent:24px;font-size:10pt;""><font style=""font-family:inherit;font-size:10pt;"">The excess of purchase price over the estimated fair value of tangible assets acquired amounted to </font><font style=""font-family:inherit;font-size:10pt;color:#000000;text-decoration:none;"">$2,657 million</font><font style=""font-family:inherit;font-size:10pt;"">&#32;and has been assigned to identifiable intangibl"
200406,000020040613000038,ex13-form10xk20121230.htm,sec_cache_light_fix/CIK200406/000020040613000038/ex13-form10xk20121230.htm,purchase price,"$1,185","scovery company focused on developing small-molecule, inhaled therapies for the treatment of pulmonary diseases; and Micrus Endovascular LLC, a global developer and manufacturer of minimally invasive devices for hemorrhagic and ischemic stroke.</font></div><div style=""line-height:120%;text-align:left;text-indent:24px;font-size:10pt;""><font style=""font-family:inherit;font-size:10pt;"">The excess of purchase price over the estimated fair value of tangible assets acquired amounted to </font><font style=""font-family:inherit;font-size:10pt;color:#000000;text-decoration:none;"">$1,185 million</font><font style=""font-family:inherit;font-size:10pt;"">&#32;and has been assigned to identifiable intangibl"
200406,000095015717000161,ex2-1.htm,sec_cache_light_fix/CIK200406/000095015717000161/ex2-1.htm,aggregate consideration,191.5 million|98.3 million,"fy""> <div style=""FONT-SIZE: 10pt"">resolved or approved any dividend, other distribution or capital reduction or any acquisition, spin-off (<font style=""FONT-SIZE: 10pt; FONT-STYLE: italic"">Abspaltung</font>), transfer of assets and liabilities (<font style=""FONT-SIZE: 10pt; FONT-STYLE: italic"">Verm&#246;gens&#252;bertragung</font>) or other disposal of assets (x) with an aggregate value or for an aggregate consideration of more than CHF 191.5 million (corresponding to 10% of the consolidated total assets of the Company and its Subsidiaries as of December 31, 2015, as per the Company's annual report 2015), or (y) contributing in the aggregate more than CHF 98.3 million<font style=""FONT-SIZE: "
200406,000020040614000033,ex13-form10xk20131229.htm,sec_cache_light_fix/CIK200406/000020040614000033/ex13-form10xk20131229.htm,purchase price,$941,"0;&#160;&#160;&#160;&#160;&#160;&#160;&#160;&#160;&#160;&#160;&#160;&#160;</font></div></div><hr style=""page-break-after:always""><div><div style=""line-height:120%;font-size:10pt;""><font style=""font-family:inherit;font-size:10pt;""><br></font></div></div><br><div style=""line-height:120%;text-align:left;text-indent:24px;font-size:10pt;""><font style=""font-family:inherit;font-size:10pt;"">The excess of purchase price over the estimated fair value of tangible assets acquired amounted to </font><font style=""font-family:inherit;font-size:10pt;"">$941 million</font><font style=""font-family:inherit;font-size:10pt;"">&#32;and has been assigned to identifiable intangible assets, with any residual recorded "
200406,000020040614000033,ex13-form10xk20131229.htm,sec_cache_light_fix/CIK200406/000020040614000033/ex13-form10xk20131229.htm,purchase price,"$15,785","RTEC</font><font style=""font-family:inherit;font-size:10pt;""><sup style=""vertical-align:top;line-height:120%;font-size:7pt"">&#174;</sup></font><font style=""font-family:inherit;font-size:10pt;"">&#32;related market rights in Australia and Canada.</font></div><div style=""line-height:120%;text-align:left;text-indent:24px;font-size:10pt;""><font style=""font-family:inherit;font-size:10pt;"">The excess of purchase price over the estimated fair value of tangible assets acquired amounted to </font><font style=""font-family:inherit;font-size:10pt;color:#000000;text-decoration:none;"">$15,785 million</font><font style=""font-family:inherit;font-size:10pt;"">&#32;and has been assigned to identifiable intangib"
