filer_cik10,accession_nodash,exhibit_file,path,matched_phrase,money_in_window,snippet
105319,000119312506258064,dex102.htm,sec_cache_light_fix/CIK105319/000119312506258064/dex102.htm,purchase price,"$1,000,000,000","nbsp;&nbsp;</FONT></TD> <TD VALIGN=""bottom""><FONT FACE=""Times New Roman"" SIZE=""2"">Weight Watchers International, Inc., a Virginia corporation (the &#147;<B><I>Borrower</I></B>&#148;).</FONT></TD></TR> <TR> <TD HEIGHT=""8""></TD> <TD HEIGHT=""8"" COLSPAN=""2""></TD> <TD HEIGHT=""8"" COLSPAN=""2""></TD></TR> <TR> <TD VALIGN=""top""><FONT FACE=""Times New Roman"" SIZE=""2""><U>Transactions</U>:</FONT></TD> <TD VALIGN=""bottom""><FONT SIZE=""1"">&nbsp;&nbsp;</FONT></TD> <TD VALIGN=""bottom""></TD> <TD VALIGN=""bottom""><FONT SIZE=""1"">&nbsp;&nbsp;</FONT></TD> <TD VALIGN=""bottom""><FONT FACE=""Times New Roman"" SIZE=""2"">The Borrower intends to (a)&nbsp;make a public tender offer to acquire, and enter into an agreement with "
105319,000119312513315209,d577586dex101.htm,sec_cache_light_fix/CIK105319/000119312513315209/d577586dex101.htm,Consideration,"$2,000,000|$1,000,000","; text-indent:8%""><FONT STYLE=""font-family:Times New Roman"" SIZE=""2"">(c) Subject to (i)&nbsp;your employment during the Transition Period not being terminated for Cause, (ii)&nbsp;your continued compliance with the terms of this Agreement, and (iii)&nbsp;your executing the Release Agreement (the &#147;<U>Bring-Down Release</U>&#148;), attached hereto as <U>Exhibit A</U>, following the termination of your employment but on or prior to the expiration of the Review Period (as such term is defined in the Bring-Down Release), and subject to such Bring-Down Release becoming effective in accordance with its terms on the Release Effective Date (as such term is defined in the Bring-Down Release), the"
105319,000119312513315209,d577586dex101.htm,sec_cache_light_fix/CIK105319/000119312513315209/d577586dex101.htm,In consideration,$500,"ZE=""1"">&nbsp;</FONT></P> <P STYLE=""margin-top:0px;margin-bottom:0px"" ALIGN=""center""><FONT STYLE=""font-family:Times New Roman"" SIZE=""2"">5 </FONT></P> <p Style='page-break-before:always'> <HR SIZE=""3"" style=""COLOR:#999999"" WIDTH=""100%"" ALIGN=""CENTER""> <P STYLE=""margin-top:0px;margin-bottom:0px; text-indent:4%""><FONT STYLE=""font-family:Times New Roman"" SIZE=""2"">7. <U>Cooperation</U>. </FONT></P> <P STYLE=""margin-top:12px;margin-bottom:0px; text-indent:8%""><FONT STYLE=""font-family:Times New Roman"" SIZE=""2"">(a) You agree that you will provide reasonable cooperation to the Company and its counsel in connection with any investigation, administrative proceeding or litigation relating to any matter t"
105319,000119312519314680,d849846dex103.htm,sec_cache_light_fix/CIK105319/000119312519314680/d849846dex103.htm,purchase price,$38.84,"size:10pt; font-family:Times New Roman"">WHEREAS, in accordance with&nbsp;Section 8.3&nbsp;of the Share Purchase Agreement, the parties hereto wish to amend certain provisions of the Share Purchase Agreement as described herein; and </P> <P STYLE=""margin-top:12pt; margin-bottom:0pt; text-indent:4%; font-size:10pt; font-family:Times New Roman"">WHEREAS, substantially concurrent with the execution and delivery of this Amendment, the Company and OW shall execute and deliver the WW International, Inc. Term Sheet for Consultant Stock Option Award, including the Terms and Conditions relating thereto, dated the date hereof (the &#147;<U>Option Agreement</U>&#148;), pursuant to which the Company grant"
105319,000119312519314680,d849846dex103.htm,sec_cache_light_fix/CIK105319/000119312519314680/d849846dex103.htm,in consideration,$38.84,"an"">WHEREAS, substantially concurrent with the execution and delivery of this Amendment, the Company and OW shall execute and deliver the WW International, Inc. Term Sheet for Consultant Stock Option Award, including the Terms and Conditions relating thereto, dated the date hereof (the &#147;<U>Option Agreement</U>&#148;), pursuant to which the Company grants OW an option to purchase an aggregate of 3,276,484 shares of the Company&#146;s Common Stock at a purchase price of $38.84 per share (the &#147;<U>Granted Options</U>&#148;), and the Company and OW shall execute and deliver the First Amendment of Strategic Collaboration Agreement, dated as of the date hereof. </P> <P STYLE=""margin-top:1"
105319,000119312507013694,dex102.htm,sec_cache_light_fix/CIK105319/000119312507013694/dex102.htm,in consideration,"$700,000,000|$135,000,000|$565,000,000|$500,000,000","to clause (b)&nbsp;of Section&nbsp;2.1.6 of the Existing Credit Agreement, the Borrower has requested (i)&nbsp;up to $700,000,000 of loans to be provided under a new tranche of term loans (the &#147;<U>Term A-1 Loans</U>&#148;), of which $135,000,000 will be provided on the Supplement Effective Date and up to $565,000,000 will be provided on the Delayed Draw Date and (ii)&nbsp;$500,000,000 of loans to be provided under a new tranche of term loans (the &#147;<U>Term B Loans</U>&#148;) on the Supplement Effective Date, and this Supplement is being executed and delivered to evidence the terms of, and give effect to the making of, such Term A-1 Loans and Term B Loans; </FONT></P> <P STYLE=""margi"
105319,000119312507013694,dex101.htm,sec_cache_light_fix/CIK105319/000119312507013694/dex101.htm,purchase price,"$1,000,000,000|$1,200,000,000|$700,000,000|$500,000,000","tated Credit Agreement, dated as of May&nbsp;8, 2006 (as further amended, supplemented or otherwise modified prior to the date hereof, the &#147;<U>Existing Credit Agreement</U>&#148;), among the Borrower, the Lenders, The Bank of Nova Scotia, as administrative agent (in such capacity, the &#147;<U>Administrative Agent</U>&#148;) for the Lenders, and the other Agents, the Lenders have made, and are committed to make, Credit Extensions to the Borrower; </FONT></P> <P STYLE=""margin-top:12px;margin-bottom:0px; text-indent:4%""><FONT FACE=""Times New Roman"" SIZE=""2"">WHEREAS, that Borrower has announced its intention to make a public tender offer to acquire, and has entered into an agreement with a"
105319,000119312507013694,dex101.htm,sec_cache_light_fix/CIK105319/000119312507013694/dex101.htm,in consideration,"$700,000,000|$135,000,000|$565,000,000|$500,000,000","to clause (b)&nbsp;of Section&nbsp;2.1.6 of the Existing Credit Agreement, the Borrower has requested (i)&nbsp;up to $700,000,000 of loans to be provided under a new tranche of term loans (the &#147;<U>Term A-1 Loans</U>&#148;), of which $135,000,000 will be provided on the Supplement Effective Date and up to $565,000,000 will be provided on the Delayed Draw Date and (ii)&nbsp;$500,000,000 of loans to be provided under a new tranche of term loans (the &#147;<U>Term B Loans</U>&#148;) on the Supplement Effective Date, and this Supplement is being executed and delivered to evidence the terms of, and give effect to the making of, such Term A-1 Loans and Term B Loans; </FONT></P> <P STYLE=""margi"
105319,000119312513079926,d450348dex1031.htm,sec_cache_light_fix/CIK105319/000119312513079926/d450348dex1031.htm,consideration,"$1,100","ALIGN=""CENTER""> <TABLE CELLSPACING=""0"" CELLPADDING=""0"" WIDTH=""100%"" BORDER=""0"" STYLE=""BORDER-COLLAPSE:COLLAPSE"" ALIGN=""center""> <TR> <TD WIDTH=""35%""></TD> <TD VALIGN=""bottom"" WIDTH=""1%""></TD> <TD WIDTH=""32%""></TD> <TD VALIGN=""bottom"" WIDTH=""1%""></TD> <TD WIDTH=""31%""></TD></TR> <TR> <TD VALIGN=""top""></TD> <TD VALIGN=""bottom""><FONT SIZE=""1"">&nbsp;&nbsp;</FONT></TD> <TD VALIGN=""top"" COLSPAN=""3""><FONT STYLE=""font-family:Times New Roman"" SIZE=""2"">Omnibus Budget Reconciliation Act (&#147;COBRA&#148;) for six (6) months following the termination (or such shorter period of time if you obtain alternative health coverage from another employer); provided, however, such Severance shall not be paid in th"
105319,000119312513079926,d450348dex1034.htm,sec_cache_light_fix/CIK105319/000119312513079926/d450348dex1034.htm,consideration,"$1,100","than for Cause (as such term is defined in those certain Terms and Conditions for Employee Stock Awards to be executed in connection with the Incentive Equity Award described above), the Corporation shall pay you six (6)&nbsp;months of Base Salary in one lump sum within thirty (30)&nbsp;day of termination and the Corporation shall pay for your continued health coverage under the Corporation-sponsored health plans pursuant to the Consolidated Omnibus Budget Reconciliation Act (&#147;COBRA&#148;) for six (6)&nbsp;months following the termination (or such shorter period of time if you obtain alternative health coverage from another employer); provided, however, such Severance shall not be paid "
105319,000119312511115257,dex101.htm,sec_cache_light_fix/CIK105319/000119312511115257/dex101.htm,Purchase Price,"$1,000",""" BORDER=""0"" CELLPADDING=""0"" CELLSPACING=""0"" WIDTH=""100%""> <TR> <TD WIDTH=""4%"" VALIGN=""top"" ALIGN=""left""><FONT STYLE=""font-family:Times New Roman"" SIZE=""2"">2.2</FONT></TD> <TD ALIGN=""left"" VALIGN=""top""><FONT STYLE=""font-family:Times New Roman"" SIZE=""2""><U>Condition Precedent</U>. Prior to the Closing, the Parties shall have made the capital contributions to the Company previously agreed between the Parties. </FONT></TD></TR></TABLE> <P STYLE=""font-size:6px;margin-top:0px;margin-bottom:0px"">&nbsp;</P> <TABLE STYLE=""BORDER-COLLAPSE:COLLAPSE"" BORDER=""0"" CELLPADDING=""0"" CELLSPACING=""0"" WIDTH=""100%""> <TR> <TD WIDTH=""4%"" VALIGN=""top"" ALIGN=""left""><FONT STYLE=""font-family:Times New Roman"" SIZE=""2"">"
105319,000119312511115257,dex101.htm,sec_cache_light_fix/CIK105319/000119312511115257/dex101.htm,purchase price,"$1,000","WIDTH=""100%""> <TR> <TD WIDTH=""4%"" VALIGN=""top"" ALIGN=""left""><FONT STYLE=""font-family:Times New Roman"" SIZE=""2"">2.2</FONT></TD> <TD ALIGN=""left"" VALIGN=""top""><FONT STYLE=""font-family:Times New Roman"" SIZE=""2""><U>Condition Precedent</U>. Prior to the Closing, the Parties shall have made the capital contributions to the Company previously agreed between the Parties. </FONT></TD></TR></TABLE> <P STYLE=""font-size:6px;margin-top:0px;margin-bottom:0px"">&nbsp;</P> <TABLE STYLE=""BORDER-COLLAPSE:COLLAPSE"" BORDER=""0"" CELLPADDING=""0"" CELLSPACING=""0"" WIDTH=""100%""> <TR> <TD WIDTH=""4%"" VALIGN=""top"" ALIGN=""left""><FONT STYLE=""font-family:Times New Roman"" SIZE=""2"">2.3</FONT></TD> <TD ALIGN=""left"" VALIGN=""top"""
105319,000119312511115257,dex101.htm,sec_cache_light_fix/CIK105319/000119312511115257/dex101.htm,Purchase Price,"$1,000","E=""font-family:Times New Roman"" SIZE=""2"">2.2</FONT></TD> <TD ALIGN=""left"" VALIGN=""top""><FONT STYLE=""font-family:Times New Roman"" SIZE=""2""><U>Condition Precedent</U>. Prior to the Closing, the Parties shall have made the capital contributions to the Company previously agreed between the Parties. </FONT></TD></TR></TABLE> <P STYLE=""font-size:6px;margin-top:0px;margin-bottom:0px"">&nbsp;</P> <TABLE STYLE=""BORDER-COLLAPSE:COLLAPSE"" BORDER=""0"" CELLPADDING=""0"" CELLSPACING=""0"" WIDTH=""100%""> <TR> <TD WIDTH=""4%"" VALIGN=""top"" ALIGN=""left""><FONT STYLE=""font-family:Times New Roman"" SIZE=""2"">2.3</FONT></TD> <TD ALIGN=""left"" VALIGN=""top""><FONT STYLE=""font-family:Times New Roman"" SIZE=""2""><U>Purchase Price "
105319,000119312511115257,dex101.htm,sec_cache_light_fix/CIK105319/000119312511115257/dex101.htm,Purchase Price,"$1,000","SE"" BORDER=""0"" CELLPADDING=""0"" CELLSPACING=""0"" WIDTH=""100%""> <TR> <TD WIDTH=""4%"" VALIGN=""top"" ALIGN=""left""><FONT STYLE=""font-family:Times New Roman"" SIZE=""2"">2.3</FONT></TD> <TD ALIGN=""left"" VALIGN=""top""><FONT STYLE=""font-family:Times New Roman"" SIZE=""2""><U>Purchase Price for Transfer Shares</U>. The purchase price for the Transfer Shares shall be US$1,000 (the &#147;<U>Purchase Price</U>&#148;). </FONT></TD></TR></TABLE> <P STYLE=""font-size:6px;margin-top:0px;margin-bottom:0px"">&nbsp;</P> <TABLE STYLE=""BORDER-COLLAPSE:COLLAPSE"" BORDER=""0"" CELLPADDING=""0"" CELLSPACING=""0"" WIDTH=""100%""> <TR> <TD WIDTH=""4%"" VALIGN=""top"" ALIGN=""left""><FONT STYLE=""font-family:Times New Roman"" SIZE=""2"">2.4</FONT><"
105319,000119312511115257,dex101.htm,sec_cache_light_fix/CIK105319/000119312511115257/dex101.htm,Purchase Price,"$1,000","<TD WIDTH=""4%"" VALIGN=""top"" ALIGN=""left""><FONT STYLE=""font-family:Times New Roman"" SIZE=""2"">2.3</FONT></TD> <TD ALIGN=""left"" VALIGN=""top""><FONT STYLE=""font-family:Times New Roman"" SIZE=""2""><U>Purchase Price for Transfer Shares</U>. The purchase price for the Transfer Shares shall be US$1,000 (the &#147;<U>Purchase Price</U>&#148;). </FONT></TD></TR></TABLE> <P STYLE=""font-size:6px;margin-top:0px;margin-bottom:0px"">&nbsp;</P> <TABLE STYLE=""BORDER-COLLAPSE:COLLAPSE"" BORDER=""0"" CELLPADDING=""0"" CELLSPACING=""0"" WIDTH=""100%""> <TR> <TD WIDTH=""4%"" VALIGN=""top"" ALIGN=""left""><FONT STYLE=""font-family:Times New Roman"" SIZE=""2"">2.4</FONT></TD> <TD ALIGN=""left"" VALIGN=""top""><FONT STYLE=""font-family:Times "
318154,000119312517167330,d389370dex42.htm,sec_cache_light_fix/CIK318154/000119312517167330/d389370dex42.htm,purchase price,"$75,000,000","e='page-break-before:always'> <HR SIZE=""3"" style=""COLOR:#999999"" WIDTH=""100%"" ALIGN=""CENTER""> <P STYLE=""margin-top:0pt; margin-bottom:0pt; text-indent:4%; font-size:10pt; font-family:Times New Roman"" ALIGN=""justify"">(18)&nbsp;Liens consisting of deposits of Property to secure (or in lieu of) surety, appeal or customs bonds in proceedings to which the Company or any of its Subsidiaries is a party in the ordinary course of its business, but not in excess of $75,000,000; </P> <P STYLE=""margin-top:12pt; margin-bottom:0pt; text-indent:4%; font-size:10pt; font-family:Times New Roman"" ALIGN=""justify"">(19)&nbsp;purchase money Liens or purchase money security interests upon or in any Property acquire"
1108205,000119312508057344,dex1019.htm,sec_cache_light_fix/CIK1108205/000119312508057344/dex1019.htm,In consideration,"$200|$250.00|$20,000","FACE=""Times New Roman"" SIZE=""2"">Consultant shall devote his best efforts and ability to the performance of the duties attaching to this obligation, devoting an amount of time as mutually agreed. All work performed by Consultant for Curis shall be at times reasonably convenient to him/her. Consultant agrees to furnish Curis with written reports with respect to such consulting services if and when requested by Curis. </FONT></TD></TR></TABLE> <P STYLE=""font-size:6px;margin-top:0px;margin-bottom:0px"">&nbsp;</P> <TABLE STYLE=""BORDER-COLLAPSE:COLLAPSE"" BORDER=""0"" CELLPADDING=""0"" CELLSPACING=""0"" WIDTH=""100%""> <TR> <TD WIDTH=""4%"" VALIGN=""top"" ALIGN=""left""><FONT FACE=""Times New Roman"" SIZE=""2"">3.</F"
924383,000089843002001998,dex102.txt,sec_cache_light_fix/CIK924383/000089843002001998/dex102.txt,Purchase Price,$4.50,"ND ANY APPLICABLE STATE SECURITIES LAWS. WARRANT TO PURCHASE _________ SHARES OF COMMON STOCK OF AMERICAN TECHNOLOGY CORPORATION (Void after March 31, 2007) This certifies that _________________________________ or its assigns (the ""Holder""), for value received, is entitled to purchase from American Technology Corporation, a Delaware corporation (the ""Company""), having a place of business at 13114 Evening Creek Drive South, San Diego, California 92128, a maximum of ______________ fully paid and nonassessable shares of the Company's Common Stock (""Common Stock"") for cash at a price of Four Dollars and Fifty Cents ($4.50) per share, as may be adjusted as provided herein (the ""Stock Purchase Pri"
924383,000089843002001998,dex102.txt,sec_cache_light_fix/CIK924383/000089843002001998/dex102.txt,Purchase Price,$4.50,"oration (the ""Company""), having a place of business at 13114 Evening Creek Drive South, San Diego, California 92128, a maximum of ______________ fully paid and nonassessable shares of the Company's Common Stock (""Common Stock"") for cash at a price of Four Dollars and Fifty Cents ($4.50) per share, as may be adjusted as provided herein (the ""Stock Purchase Price""), at any time or from time to time up to and including 5:00 p.m. (Pacific time) on March 31, 2007 (the ""Expiration Date""), upon surrender to the Company at its principal office (or at such other location as the Company may advise the Holder in writing) of this Warrant properly endorsed with the Form of Subscription attached hereto du"
924383,000089843002001998,dex102.txt,sec_cache_light_fix/CIK924383/000089843002001998/dex102.txt,Purchase Price,$4.50,"fully paid and nonassessable shares of the Company's Common Stock (""Common Stock"") for cash at a price of Four Dollars and Fifty Cents ($4.50) per share, as may be adjusted as provided herein (the ""Stock Purchase Price""), at any time or from time to time up to and including 5:00 p.m. (Pacific time) on March 31, 2007 (the ""Expiration Date""), upon surrender to the Company at its principal office (or at such other location as the Company may advise the Holder in writing) of this Warrant properly endorsed with the Form of Subscription attached hereto duly filled in and signed and, if applicable, upon payment in cash or by check of the aggregate Stock Purchase Price for the number of shares for w"
924383,000089843002001998,dex102.txt,sec_cache_light_fix/CIK924383/000089843002001998/dex102.txt,purchase price,$4.50,"Name: ATTEST: _______________________________ Name: Title: 10. <PAGE> Exhibit A SUBSCRIPTION FORM Date: _________________, _____ American Technology Corporation 13114 Evening Creek Drive South San Diego, California 92128 Attn: President Ladies and Gentlemen: The undersigned hereby elects to exercise the warrant issued to it by American Technology Corporation (the ""Company"") and dated April _____, 2002, Warrant No. W-D___ (the ""Warrant"") and to purchase thereunder ___________________________ shares of the Common Stock of the Company (the ""Shares"") at a purchase price of Four Dollars and Fifty Cents ($4.50) per Share for an aggregate purchase price of _____________________ Dollars ($__________"
924383,000089843002001998,dex102.txt,sec_cache_light_fix/CIK924383/000089843002001998/dex102.txt,purchase price,$4.50,"ame: Title: 10. <PAGE> Exhibit A SUBSCRIPTION FORM Date: _________________, _____ American Technology Corporation 13114 Evening Creek Drive South San Diego, California 92128 Attn: President Ladies and Gentlemen: The undersigned hereby elects to exercise the warrant issued to it by American Technology Corporation (the ""Company"") and dated April _____, 2002, Warrant No. W-D___ (the ""Warrant"") and to purchase thereunder ___________________________ shares of the Common Stock of the Company (the ""Shares"") at a purchase price of Four Dollars and Fifty Cents ($4.50) per Share for an aggregate purchase price of _____________________ Dollars ($__________) (the ""Purchase Price""). Pursuant to the terms"
924383,000089843002001998,dex102.txt,sec_cache_light_fix/CIK924383/000089843002001998/dex102.txt,Purchase Price,$4.50,"10. <PAGE> Exhibit A SUBSCRIPTION FORM Date: _________________, _____ American Technology Corporation 13114 Evening Creek Drive South San Diego, California 92128 Attn: President Ladies and Gentlemen: The undersigned hereby elects to exercise the warrant issued to it by American Technology Corporation (the ""Company"") and dated April _____, 2002, Warrant No. W-D___ (the ""Warrant"") and to purchase thereunder ___________________________ shares of the Common Stock of the Company (the ""Shares"") at a purchase price of Four Dollars and Fifty Cents ($4.50) per Share for an aggregate purchase price of _____________________ Dollars ($__________) (the ""Purchase Price""). Pursuant to the terms of the Warr"
924383,000089843002001998,dex102.txt,sec_cache_light_fix/CIK924383/000089843002001998/dex102.txt,Purchase Price,$4.50,"SUBSCRIPTION FORM Date: _________________, _____ American Technology Corporation 13114 Evening Creek Drive South San Diego, California 92128 Attn: President Ladies and Gentlemen: The undersigned hereby elects to exercise the warrant issued to it by American Technology Corporation (the ""Company"") and dated April _____, 2002, Warrant No. W-D___ (the ""Warrant"") and to purchase thereunder ___________________________ shares of the Common Stock of the Company (the ""Shares"") at a purchase price of Four Dollars and Fifty Cents ($4.50) per Share for an aggregate purchase price of _____________________ Dollars ($__________) (the ""Purchase Price""). Pursuant to the terms of the Warrant the undersigned h"
1090872,000119312505235987,dex992.htm,sec_cache_light_fix/CIK1090872/000119312505235987/dex992.htm,purchase price,$4|$4.466|$37.00|$2.99,"es effect to these transactions as if they had occurred on July&nbsp;31, 2005. </FONT></P> <P STYLE=""margin-top:0px;margin-bottom:0px""><FONT SIZE=""1"">&nbsp;</FONT></P> <P STYLE=""margin-top:0px;margin-bottom:0px; text-indent:4%""><FONT FACE=""Times New Roman"" SIZE=""2"">While we have also announced our current intent to attempt to spin-off our System-On-Chip (&#147;SOC&#148;) and Memory Test businesses, now regrouped in our Semiconductor Test Solutions or STS segment, in 2006, it is not taken into account in the pro forma financial information below. On September&nbsp;22, 2005, we announced that we had increased the size of our share repurchase program, of which the Offer is an integral part, fro"
1090872,000119312505235987,dex992.htm,sec_cache_light_fix/CIK1090872/000119312505235987/dex992.htm,purchase price,$948.5|$51.3|$1.0|$100,"FACE=""Times New Roman"" SIZE=""2"">The provision for income taxes associated with the sale has been estimated based on the tax impact in each of the jurisdictions where net assets are to be sold. This provision also takes into account any valuation allowance adjustments in jurisdictions which have a full valuation allowance. </FONT></TD></TR></TABLE> <p Style='page-break-before:always'> <HR SIZE=""3"" COLOR=""#999999"" WIDTH=""100%"" ALIGN=""CENTER""> <P STYLE=""margin-top:0px;margin-bottom:0px""><FONT FACE=""Times New Roman"" SIZE=""2"">B </FONT></P> <P STYLE=""margin-top:0px;margin-bottom:-6px""><FONT SIZE=""1"">&nbsp;</FONT></P> <P STYLE=""margin-top:0px;margin-bottom:0px; margin-left:4%""><FONT FACE=""Times New"
1090872,000119312505181522,dex1055.htm,sec_cache_light_fix/CIK1090872/000119312505181522/dex1055.htm,purchase price,"$25,000","month Purchase Periods commencing at the beginning of each fiscal year half (November 1 and May 1). The Committee shall have the power to change the duration of future Purchase Periods, without Shareholder approval, and without regard to the expectations of any Participants. </FONT></P> <P STYLE=""margin-top:0px;margin-bottom:0px""><FONT SIZE=""1"">&nbsp;</FONT></P> <P STYLE=""margin-top:0px;margin-bottom:0px; text-indent:4%""><FONT FACE=""Times New Roman"" SIZE=""2"">7.3 Each eligible Employee who has elected to participate as provided in Section 5.1 shall be granted an option to purchase that number of whole and fractional shares of Common Stock (not to exceed 5,000 shares) which may be purchased wi"
1090872,000119312505181522,dex1055.htm,sec_cache_light_fix/CIK1090872/000119312505181522/dex1055.htm,purchase price,"$25,000","umulated on behalf of such Employee during each Purchase Period at the purchase price specified in Section 7.4 below, subject to the additional limitation that no Employee participating in the Section 423 Plan shall be granted an option to purchase Common Stock under the Plan at a rate which exceeds U.S. twenty-five thousand dollars (U.S. $25,000) of the Fair Market Value of such Common Stock (determined at the time such option is granted) for each calendar year in which such option is outstanding at any time. The foregoing sentence shall be interpreted so as to comply with Code Section 423(b)(8). </FONT></P> <P STYLE=""margin-top:0px;margin-bottom:0px""><FONT SIZE=""1"">&nbsp;</FONT></P> <P STY"
1090872,000110465905061577,a05-21802_1ex99d2.htm,sec_cache_light_fix/CIK1090872/000110465905061577/a05-21802_1ex99d2.htm,cash consideration,"$32.00|$37.00|$1,000,000,000","$32.00 and not greater than $37.00 pursuant to a tender offer launched on November 15, 2005 (the &#147;<b><i><font style=""font-style:italic;font-weight:bold;"">Stock Re-Purchase</font></i></b>&#148;).</p> <p style=""margin:0in 0in .0001pt;text-indent:1.0in;""><font size=""2"" face=""Times New Roman"" style=""font-size:10.0pt;"">&nbsp;</font></p> <p style=""font-size:10.0pt;margin:0in 0in .0001pt;text-indent:1.0in;""><font size=""2"" face=""Times New Roman"" style=""font-size:10.0pt;"">(2)</font><font size=""1"" style=""font-size:8.5pt;"">&#160;&#160;&#160;&#160;&#160;&#160;&#160;&#160;&#160;&#160; </font>The Borrower has requested that, upon the consummation of the Stock Re-Purchase, the Lenders lend to the Borr"
1090872,000110465905061577,a05-21802_1ex99d2.htm,sec_cache_light_fix/CIK1090872/000110465905061577/a05-21802_1ex99d2.htm,in consideration,"$1,000,000,000","0;&#160;&#160;&#160;&#160;&#160;&#160;&#160;&#160; </font>The Borrower has requested that, upon the consummation of the Stock Re-Purchase, the Lenders lend to the Borrower up to $1,000,000,000 to allow the Guarantor to pay to the holders of the Guarantor Stock the cash consideration for their Guarantor Stock in the Stock Re-Purchase and pay transaction fees and expenses in connection therewith.&#160; The Lenders have indicated their willingness to agree to lend such amounts on the terms and conditions of this Agreement.</p> <p style=""margin:0in 0in .0001pt;text-indent:1.0in;""><font size=""2"" face=""Times New Roman"" style=""font-size:10.0pt;"">&nbsp;</font></p> <p style=""margin:0in 0in .0001pt;te"
