filer_cik10,accession_nodash,exhibit_file,path,matched_phrase,money_in_window,snippet
856982,000110465909017964,a09-1365_2ex10d1.htm,sec_cache_light_fix/CIK856982/000110465909017964/a09-1365_2ex10d1.htm,consideration,$19|$1.6|$15|$40,"n;""><font size=""2"" face=""Times New Roman"" style=""font-size:10.0pt;"">&nbsp;</font></p> <p style=""margin:0in 0in .0001pt;text-indent:.5in;""><font size=""2"" face=""Times New Roman"" style=""font-size:10.0pt;"">2.&#160; <u>Amendments to Agreement</u>.&#160; The Agreement is hereby amended by the Bank and the Borrower as follows:</font></p> <p style=""margin:0in 0in .0001pt;text-indent:.5in;""><font size=""2"" face=""Times New Roman"" style=""font-size:10.0pt;"">&nbsp;</font></p> <p style=""margin:0in 0in .0001pt 63.0pt;text-indent:-13.5pt;""><font size=""2"" face=""Times New Roman"" style=""font-size:10.0pt;"">2.1&#160; <u>Consent to Acquisitions</u>.&#160; Notwithstanding the provisions of Section&nbsp;7.11(b)&nbsp"
856982,000110465909017964,a09-1365_2ex10d1.htm,sec_cache_light_fix/CIK856982/000110465909017964/a09-1365_2ex10d1.htm,consideration,$19|$1.6|$15|$40,"n .0001pt;text-indent:.5in;""><font size=""2"" face=""Times New Roman"" style=""font-size:10.0pt;"">2.&#160; <u>Amendments to Agreement</u>.&#160; The Agreement is hereby amended by the Bank and the Borrower as follows:</font></p> <p style=""margin:0in 0in .0001pt;text-indent:.5in;""><font size=""2"" face=""Times New Roman"" style=""font-size:10.0pt;"">&nbsp;</font></p> <p style=""margin:0in 0in .0001pt 63.0pt;text-indent:-13.5pt;""><font size=""2"" face=""Times New Roman"" style=""font-size:10.0pt;"">2.1&#160; <u>Consent to Acquisitions</u>.&#160; Notwithstanding the provisions of Section&nbsp;7.11(b)&nbsp;of the Agreement, the Bank consents to (a)&nbsp;the Borrower&#146;s acquisition of Alveolus for consideratio"
856982,000110465909017964,a09-1365_2ex10d1.htm,sec_cache_light_fix/CIK856982/000110465909017964/a09-1365_2ex10d1.htm,consideration,$19|$1.6|$15|$40,"reement</u>.&#160; The Agreement is hereby amended by the Bank and the Borrower as follows:</font></p> <p style=""margin:0in 0in .0001pt;text-indent:.5in;""><font size=""2"" face=""Times New Roman"" style=""font-size:10.0pt;"">&nbsp;</font></p> <p style=""margin:0in 0in .0001pt 63.0pt;text-indent:-13.5pt;""><font size=""2"" face=""Times New Roman"" style=""font-size:10.0pt;"">2.1&#160; <u>Consent to Acquisitions</u>.&#160; Notwithstanding the provisions of Section&nbsp;7.11(b)&nbsp;of the Agreement, the Bank consents to (a)&nbsp;the Borrower&#146;s acquisition of Alveolus for consideration of approximately $19 million and (b)&nbsp;the Borrower&#146;s acquisition of Biosearch Inc. for consideration of approx"
856982,000110465909017964,a09-1365_2ex10d1.htm,sec_cache_light_fix/CIK856982/000110465909017964/a09-1365_2ex10d1.htm,consideration,$19|$1.6|$15|$40,"size:10.0pt;"">&nbsp;</font></p> <p style=""margin:0in 0in .0001pt 63.0pt;text-indent:-13.5pt;""><font size=""2"" face=""Times New Roman"" style=""font-size:10.0pt;"">2.1&#160; <u>Consent to Acquisitions</u>.&#160; Notwithstanding the provisions of Section&nbsp;7.11(b)&nbsp;of the Agreement, the Bank consents to (a)&nbsp;the Borrower&#146;s acquisition of Alveolus for consideration of approximately $19 million and (b)&nbsp;the Borrower&#146;s acquisition of Biosearch Inc. for consideration of approximately $1.6 million (the &#147;2009 Acquisitions&#148;).&#160; Furthermore, the Bank agrees that consideration paid by Borrower for the 2009 Acquisitions, so long as not exceeding the amounts listed above"
856982,000110465909017964,a09-1365_2ex10d1.htm,sec_cache_light_fix/CIK856982/000110465909017964/a09-1365_2ex10d1.htm,consideration,$19|$1.6|$15|$40,"5pt;""><font size=""2"" face=""Times New Roman"" style=""font-size:10.0pt;"">2.1&#160; <u>Consent to Acquisitions</u>.&#160; Notwithstanding the provisions of Section&nbsp;7.11(b)&nbsp;of the Agreement, the Bank consents to (a)&nbsp;the Borrower&#146;s acquisition of Alveolus for consideration of approximately $19 million and (b)&nbsp;the Borrower&#146;s acquisition of Biosearch Inc. for consideration of approximately $1.6 million (the &#147;2009 Acquisitions&#148;).&#160; Furthermore, the Bank agrees that consideration paid by Borrower for the 2009 Acquisitions, so long as not exceeding the amounts listed above, shall not be taken into account for computing (i)&nbsp;the 2009 $15 million per annum "
856982,000110465909017964,a09-1365_2ex2d1.htm,sec_cache_light_fix/CIK856982/000110465909017964/a09-1365_2ex2d1.htm,Purchase Price,"$19,013,344","e=""margin:0in 0in .0001pt .5in;text-align:left;text-autospace:ideograph-numeric ideograph-other;""><font size=""2"" face=""Times New Roman"" style=""font-size:10.0pt;"">adjustment under <u>Section&nbsp;2(f)</u>, equal to Nineteen Million Thirteen Thousand Three Hundred Forty-Four Dollars ($19,013,344).</font></p> <p align=""left"" style=""margin:0in 0in .0001pt .5in;text-align:left;text-autospace:ideograph-numeric ideograph-other;text-indent:.5in;""><font size=""2"" face=""Times New Roman"" style=""font-size:10.0pt;"">&nbsp;</font></p> <p align=""left"" style=""margin:0in 0in .0001pt .5in;text-align:left;text-autospace:ideograph-numeric ideograph-other;text-indent:.5in;""><font size=""2"" face=""Times New Roman"" st"
856982,000110465909017964,a09-1365_2ex2d1.htm,sec_cache_light_fix/CIK856982/000110465909017964/a09-1365_2ex2d1.htm,purchase price,"$25,000|$25,000|$1,000|$10,000|$25,000","ule lists all written or oral contracts and other written or oral agreements to which Seller is a party and which involve any of the following (<b><i style=""font-weight:bold;"">&#147;Contracts&#148;</i></b>): (i)&nbsp;any Contract with any customer or supplier involving sales or purchases of $25,000 in any single transaction or series of related transactions; (ii)&nbsp;any Contract for capital expenditures by Seller in excess of $25,000 in the aggregate; (iii)&nbsp;any lease or license with respect to any properties, real or personal, whether as lessor, lessee, licensor or licensee involving payments in excess of $1,000 per month or $10,000 during any 12-month period; (iv)&nbsp;any Contract r"
856982,000110465909017964,a09-1365_2ex2d1.htm,sec_cache_light_fix/CIK856982/000110465909017964/a09-1365_2ex2d1.htm,Purchase Price,"$44,800|$39,400","#146;s real property landlord or the applicable equipment lessor do not agree to release the posted letters of credit (or the security related thereto) by Closing, then Buyer shall pay the amounts of the Cash security related to any such letter of credit ($44,800 with respect to the certificate of deposit held in favor of Seller&#146;s real property landlord, and $39,400 with respect to the certificate of deposit held in favor of Seller&#146;s equipment lessor) to Seller at Closing, and all such assets (Cash or otherwise) relating to such letters of credit or security shall belong to Buyer and shall be transferred to Buyer as part of the Acquired Assets.&#160; For the avoidance of doubt, Buy"
851968,000119312512513386,d458171dex101.htm,sec_cache_light_fix/CIK851968/000119312512513386/d458171dex101.htm,consideration,$0.01,"n-top:12px;margin-bottom:0px; text-indent:4%""><FONT STYLE=""font-family:Times New Roman"" SIZE=""2"">WHEREAS, pursuant to the terms of that certain Stock Purchase Agreement dated as of December&nbsp;20, 2012 (as may be amended, the &#147;<U>Purchase Agreement</U>&#148;), by and among the Parent, Mohawk International Holdings (DE) Corporation, a wholly-owned subsidiary of the Parent (&#147;<U>Purchaser</U>&#148;), and Sellers, the Purchaser shall purchase from the Sellers all of the issued share capital (the &#147;<U>Shares</U>&#148;) of Fintiles S.p.A, an Italian corporation (<I>societ&agrave; per azioni</I>) with registered address at via B. Telesio 2, Milan (Italy), registered with the Compani"
1137789,000104746909007888,a2194209zex-10_11.htm,sec_cache_light_fix/CIK1137789/000104746909007888/a2194209zex-10_11.htm,purchase price,"$25,000","ight:bold;"">OFFERING</font></b></p> <p style=""margin:0in 0in .0001pt;""><font size=""2"" face=""Times New Roman"" style=""font-size:10.0pt;"">&nbsp;</font></p> <p style=""margin:0in 0in .0001pt .5in;""><font size=""2"" face=""Times New Roman"" style=""font-size:10.0pt;"">8.1&#160;&#160;&#160;&#160;&#160;&#160;&#160;&#160;&#160;&#160; On the Offering Date of each Offering Period, each eligible Employee, whether or not such Employee has elected to participate as provided in Section 5.1, shall be granted an option to purchase that number of whole shares of Common Stock, not to exceed one thousand (1,000) shares (or such other number of shares as determined by the Committee)<i>,</i> which may be purchased with"
1137789,000104746909007888,a2194209zex-10_26.htm,sec_cache_light_fix/CIK1137789/000104746909007888/a2194209zex-10_26.htm,consideration,"$2,332,887","ect.</font></p> <p style=""margin:0in 0in .0001pt;text-indent:.5in;""><font size=""2"" face=""Times New Roman"" style=""font-size:10.0pt;"">&nbsp;</font></p> <p style=""margin:0in 0in .0001pt;text-indent:.5in;""><font size=""2"" face=""Times New Roman"" style=""font-size:10.0pt;"">6.</font><font size=""1"" style=""font-size:3.0pt;"">&#160;&#160;&#160;&#160;&#160;&#160;&#160;&#160;&#160;&#160;&#160;&#160;&#160;&#160;&#160;&#160;&#160;&#160;&#160;&#160;&#160;&#160;&#160;&#160;&#160;&#160;&#160;&#160;&#160;&#160;&#160;&#160;&#160;&#160;&#160;&#160;&#160;&#160; </font><font size=""2"" style=""font-size:10.0pt;"">Seagate will provide the following compensation and benefits to Executive (or, in the event of Executive&#14"
1137789,000119312509073113,dex101.htm,sec_cache_light_fix/CIK1137789/000119312509073113/dex101.htm,consideration,"$50,000,000","f any one or more of Intermediate Holdings, the Borrower or any Subsidiary in an aggregate principal amount exceeding $50,000,000. For purposes of determining Material Indebtedness, the &#147;principal amount&#148; of the obligations of any Person in respect of any Swap Agreement at any time shall be the maximum aggregate amount (giving effect to any netting agreements) that such Person would be required to pay if such Swap Agreement were terminated at such time. </FONT></P> <P STYLE=""margin-top:12px;margin-bottom:0px; text-indent:8%""><FONT FACE=""Times New Roman"" SIZE=""2"">&#147;<U>Material Sale</U>&#148; means, at any time, any sale, transfer or other disposition of any property or asset of "
1137789,000119312509073113,dex101.htm,sec_cache_light_fix/CIK1137789/000119312509073113/dex101.htm,consideration,"$100,000,000","0%"" ALIGN=""CENTER""> <P STYLE=""margin-top:0px;margin-bottom:0px; margin-left:4%; text-indent:4%""><FONT FACE=""Times New Roman"" SIZE=""2"">(l) investments in the form of Swap Agreements permitted under Section&nbsp;6.06; </FONT></P> <P STYLE=""margin-top:6px;margin-bottom:0px; margin-left:4%; text-indent:4%""><FONT FACE=""Times New Roman"" SIZE=""2"">(m) investments, loans, advances, guarantees and acquisitions resulting from a foreclosure by Intermediate Holdings, the Borrower or any Subsidiary with respect to any secured investment or other transfer of title with respect to any secured investment in default; </FONT></P> <P STYLE=""margin-top:6px;margin-bottom:0px; margin-left:4%; text-indent:4%""><FONT"
1034842,000110465903008018,j0139_ex10d1.htm,sec_cache_light_fix/CIK1034842/000110465903008018/j0139_ex10d1.htm,Purchase Price,$0.64,"sing:</p> <p style=""margin:0in 0in .0001pt;""><font size=""2"" face=""Times New Roman"" style=""font-size:10.0pt;"">&nbsp;</font></p> <p style=""font-size:10.0pt;margin:0in 0in .0001pt;text-indent:2.0in;""><font size=""2"" face=""Times New Roman"" style=""font-size:10.0pt;"">(a)</font><font size=""1"" style=""font-size:3.0pt;"">&#160;&#160;&#160;&#160;&#160;&#160;&#160;&#160;&#160;&#160;&#160;&#160;&#160;&#160;&#160;&#160;&#160;&#160;&#160;&#160;&#160;&#160;&#160;&#160;&#160;&#160;&#160;&#160;&#160;&#160;&#160;&#160;&#160; </font>that number of Shares determined by dividing (i) the dollar amount set forth opposite such Investor&#146;s name on <b><i><font style=""font-style:italic;font-weight:bold;"">Schedule A</"
1034842,000110465903008018,j0139_ex10d1.htm,sec_cache_light_fix/CIK1034842/000110465903008018/j0139_ex10d1.htm,purchase price,$0.64,""" face=""Times New Roman"" style=""font-size:10.0pt;"">&nbsp;</font></p> <p style=""font-size:10.0pt;margin:0in 0in .0001pt;text-indent:2.0in;""><font size=""2"" face=""Times New Roman"" style=""font-size:10.0pt;"">(a)</font><font size=""1"" style=""font-size:3.0pt;"">&#160;&#160;&#160;&#160;&#160;&#160;&#160;&#160;&#160;&#160;&#160;&#160;&#160;&#160;&#160;&#160;&#160;&#160;&#160;&#160;&#160;&#160;&#160;&#160;&#160;&#160;&#160;&#160;&#160;&#160;&#160;&#160;&#160; </font>that number of Shares determined by dividing (i) the dollar amount set forth opposite such Investor&#146;s name on <b><i><font style=""font-style:italic;font-weight:bold;"">Schedule A</font></i></b> hereto (the &#147;<b><i><font style=""font-st"
1034842,000110465903008018,j0139_ex10d1.htm,sec_cache_light_fix/CIK1034842/000110465903008018/j0139_ex10d1.htm,Purchase Price,$0.64,"0.0pt;margin:0in 0in .0001pt;text-indent:2.0in;""><font size=""2"" face=""Times New Roman"" style=""font-size:10.0pt;"">(a)</font><font size=""1"" style=""font-size:3.0pt;"">&#160;&#160;&#160;&#160;&#160;&#160;&#160;&#160;&#160;&#160;&#160;&#160;&#160;&#160;&#160;&#160;&#160;&#160;&#160;&#160;&#160;&#160;&#160;&#160;&#160;&#160;&#160;&#160;&#160;&#160;&#160;&#160;&#160; </font>that number of Shares determined by dividing (i) the dollar amount set forth opposite such Investor&#146;s name on <b><i><font style=""font-style:italic;font-weight:bold;"">Schedule A</font></i></b> hereto (the &#147;<b><i><font style=""font-style:italic;font-weight:bold;"">Aggregate Purchase Price</font></i></b>&#148;) by (ii) the p"
1034842,000110465903008018,j0139_ex10d1.htm,sec_cache_light_fix/CIK1034842/000110465903008018/j0139_ex10d1.htm,Purchase Price,$1.5|$1.5,"w Roman"" style=""font-size:10.0pt;""> <!-- SEQ.=1,FOLIO='22',FILE='C:\C2\jgarceau\0139_4\t_1444542\j0139_ex10d1.htm',USER='jgarcea',CD='May 1 17:43 2003' --> <br clear=""all"" style=""page-break-before:always;""> </font> <p align=""center"" style=""font-size:10.0pt;margin:0in 0in .0001pt;text-align:center;"">&nbsp;</p> <p style=""margin:0in 0in .0001pt;""><font size=""2"" face=""Times New Roman"" style=""font-size:10.0pt;"">contemplated hereby (subject to the limit on legal expenses set forth in Section 10.4) and (b) upon the consummation of a transaction resulting from the Superior Proposal, shall pay to the Investors an aggregate amount of $1.5 million. Each Investor&#146;s pro rata share of such $1.5 milli"
1034842,000110465903008018,j0139_ex10d1.htm,sec_cache_light_fix/CIK1034842/000110465903008018/j0139_ex10d1.htm,Purchase Price,$1.5|$1.5,".=1,FOLIO='22',FILE='C:\C2\jgarceau\0139_4\t_1444542\j0139_ex10d1.htm',USER='jgarcea',CD='May 1 17:43 2003' --> <br clear=""all"" style=""page-break-before:always;""> </font> <p align=""center"" style=""font-size:10.0pt;margin:0in 0in .0001pt;text-align:center;"">&nbsp;</p> <p style=""margin:0in 0in .0001pt;""><font size=""2"" face=""Times New Roman"" style=""font-size:10.0pt;"">contemplated hereby (subject to the limit on legal expenses set forth in Section 10.4) and (b) upon the consummation of a transaction resulting from the Superior Proposal, shall pay to the Investors an aggregate amount of $1.5 million. Each Investor&#146;s pro rata share of such $1.5 million payment shall be determined in relation t"
1034842,000104746903011133,a2106829zex-4_10.htm,sec_cache_light_fix/CIK1034842/000104746903011133/a2106829zex-4_10.htm,Purchase Price,$1.97,"#160;&#160;&#160;&#160;&#160;&#160;&#160; Purchase Price; Number of Shares</font></b><font size=""2"" style=""font-size:10.0pt;"">.&#160; The registered holder of this Warrant (the <i><font style=""font-style:italic;"">&#147;Holder&#148;</font></i>), commencing on the date hereof, is entitled upon surrender of this Warrant with the subscription form annexed hereto duly executed, at the principal office of the Company, to purchase from the Company five hundred thousand (500,000) fully paid and nonassessable shares (the &#147;<i><font style=""font-style:italic;"">Shares</font></i>&#148;) of common stock, $.001 par value per share, of the Company (the <i><font style=""font-style:italic;"">&#147;Common St"
1034842,000104746903011133,a2106829zex-4_10.htm,sec_cache_light_fix/CIK1034842/000104746903011133/a2106829zex-4_10.htm,Purchase Price,$1.97,"nt-size:10.0pt;"">.&#160; The registered holder of this Warrant (the <i><font style=""font-style:italic;"">&#147;Holder&#148;</font></i>), commencing on the date hereof, is entitled upon surrender of this Warrant with the subscription form annexed hereto duly executed, at the principal office of the Company, to purchase from the Company five hundred thousand (500,000) fully paid and nonassessable shares (the &#147;<i><font style=""font-style:italic;"">Shares</font></i>&#148;) of common stock, $.001 par value per share, of the Company (the <i><font style=""font-style:italic;"">&#147;Common Stock&#148;</font></i>), at a price per share of $1.97 (the <i><font style=""font-style:italic;"">&#147;Purchase "
68505,000110465910038421,a10-14218_1ex2d1.htm,sec_cache_light_fix/CIK68505/000110465910038421/a10-14218_1ex2d1.htm,PURCHASE PRICE,"$1,200,000,000","imes New Roman"" style=""font-size:10.0pt;"">&nbsp;</font></p> <p style=""margin:0in 0in .0001pt;""><font size=""2"" face=""Times New Roman"" style=""font-size:10.0pt;"">(collectively, clauses&nbsp;(a)&#151;(e), the &#147;<u>Transfer Documents</u>&#148;), and will be executed no later than at or as of the Initial Closing or applicable Additional Closing by the Seller and/or another member of the Seller Group, as appropriate, and the Purchaser and/or another member of the Purchaser Group, as appropriate.</font></p> <p style=""margin:0in 0in .0001pt;""><font size=""2"" face=""Times New Roman"" style=""font-size:10.0pt;"">&nbsp;</font></p> <p align=""center"" style=""margin:0in 0in .0001pt;text-align:center;""><b><fo"
68505,000110465910038421,a10-14218_1ex2d1.htm,sec_cache_light_fix/CIK68505/000110465910038421/a10-14218_1ex2d1.htm,Purchase Price,"$1,200,000,000","member of the Seller Group, as appropriate, and the Purchaser and/or another member of the Purchaser Group, as appropriate.</font></p> <p style=""margin:0in 0in .0001pt;""><font size=""2"" face=""Times New Roman"" style=""font-size:10.0pt;"">&nbsp;</font></p> <p align=""center"" style=""margin:0in 0in .0001pt;text-align:center;""><b><font size=""2"" face=""Times New Roman"" style=""font-size:10.0pt;font-weight:bold;"">ARTICLE&nbsp;2<br> PURCHASE PRICE; CLOSING</font></b></p> <p align=""center"" style=""margin:0in 0in .0001pt;text-align:center;""><font size=""2"" face=""Times New Roman"" style=""font-size:10.0pt;"">&nbsp;</font></p> <p style=""margin:0in 0in .0001pt;text-indent:.5in;""><font size=""2"" face=""Times New Roman"
68505,000110465910038421,a10-14218_1ex2d1.htm,sec_cache_light_fix/CIK68505/000110465910038421/a10-14218_1ex2d1.htm,Purchase Price,"$1,200,000,000","0001pt;text-align:center;""><b><font size=""2"" face=""Times New Roman"" style=""font-size:10.0pt;font-weight:bold;"">ARTICLE&nbsp;2<br> PURCHASE PRICE; CLOSING</font></b></p> <p align=""center"" style=""margin:0in 0in .0001pt;text-align:center;""><font size=""2"" face=""Times New Roman"" style=""font-size:10.0pt;"">&nbsp;</font></p> <p style=""margin:0in 0in .0001pt;text-indent:.5in;""><font size=""2"" face=""Times New Roman"" style=""font-size:10.0pt;"">2.1&#160;&#160;&#160;&#160;&#160;&#160;&#160;&#160;&#160;&#160; <u>Purchase Price</u>.&#160; The Purchaser will pay the Seller an amount in cash equal to $1,200,000,000 (One Billion Two Hundred Million Dollars) (the &#147;<u>Purchase Price</u>&#148;) for the Acquir"
68505,000110465910038421,a10-14218_1ex2d1.htm,sec_cache_light_fix/CIK68505/000110465910038421/a10-14218_1ex2d1.htm,Purchase Price,"$200,000,000","160;&#160;&#160;&#160;&#160;&#160;&#160;&#160; </font><font size=""2"" style=""font-size:10.0pt;"">Neither the Seller nor the Purchaser shall be required to provide indemnification to the Purchaser Indemnitees or the Seller Indemnitees, respectively, under <u>Section 8.1(a)</u> and <u>Section 8.2(a)</u> to the extent the amount of Losses paid, respectively, with respect thereto would exceed Two Hundred Million Dollars ($200,000,000).&#160; Other than with respect to Losses incurred in connection with the Excluded Liabilities described in <u>Sections 1.4(g)</u> and <u>1.4(h)</u>, the Seller&#146;s aggregate Liability for all Losses under this Agreement (whether under this <u>Article&nbsp;8</u>, <"
68505,000119312511039822,dex1010.htm,sec_cache_light_fix/CIK68505/000119312511039822/dex1010.htm,consideration,"$10,000,000","B>. The Committee shall designate the participants to whom cash incentives based upon long-term performance (&#147;Performance Cash Awards&#148;) are to be awarded and determine the amount of the award and the terms and conditions of each such award; provided the stated performance period will not be less than 12 months. Each Performance Cash Award shall entitle the participant to a payment in cash upon the attainment of performance goals and other terms and conditions specified by the Committee. </FONT></P> <P STYLE=""margin-top:12px;margin-bottom:0px; text-indent:8%""><FONT STYLE=""font-family:Times New Roman"" SIZE=""2"">Notwithstanding the satisfaction of any performance goals, the amount to b"
1779474,000095010319010751,dp111173_ex0101.htm,sec_cache_light_fix/CIK1779474/000095010319010751/dp111173_ex0101.htm,purchase price,"$0.0001|$25,000","issuance, registration, transfer, exchange, redemption, and exercise of the Warrants and the Private Placement Warrants.</FONT></P> <P STYLE=""font: 10pt Times New Roman, Times, Serif; margin: 0pt 0; text-indent: 0.5in""><FONT STYLE=""font-size: 10pt"">&nbsp;</FONT></P> <P STYLE=""font: 10pt Times New Roman, Times, Serif; margin: 0pt 0; text-indent: 0.5in""><FONT STYLE=""font-size: 10pt"">The Company has entered into a Securities Subscription Agreement, dated as of June 11, 2019 (the &ldquo;<U>Founder&rsquo;s Purchase Agreement</U>&rdquo;), with Silver Spike Sponsor, LLC, a Delaware limited liability company (the &ldquo;<U>Sponsor</U>&rdquo;), pursuant to which the Sponsor purchased an aggregate of "
1779474,000095010319010751,dp111173_ex0101.htm,sec_cache_light_fix/CIK1779474/000095010319010751/dp111173_ex0101.htm,purchase price,$9.800,"6pt; border-bottom: Black 1pt solid""><P STYLE=""margin-top: 0pt; text-align: center; margin-bottom: 0pt; font: 10pt Times New Roman, Times, Serif""><!-- Field: Sequence; Type: Arabic; Name: PageNo -->12<!-- Field: /Sequence -->&nbsp;</P></DIV> <DIV STYLE=""page-break-before: always; margin-top: 6pt; margin-bottom: 6pt""><P STYLE=""margin: 0pt"">&nbsp;</P></DIV> <!-- Field: /Page --> <P STYLE=""font: 10pt Times New Roman, Times, Serif; margin: 0pt 0; text-indent: 0.5in""><FONT STYLE=""font-size: 10pt"">(a)&nbsp;&nbsp;&nbsp;&nbsp;&nbsp;&nbsp;&nbsp;Subject to the terms and conditions and in reliance upon the representations and warranties herein set forth, the Company agrees to sell to each Underwriter, "
1779474,000095010319010751,dp111173_ex0101.htm,sec_cache_light_fix/CIK1779474/000095010319010751/dp111173_ex0101.htm,purchase price,$9.800,"Underwriter agrees, severally and not jointly, to purchase from the Company, at a purchase price of $9.800 per Unit, the amount of the Firm Securities set forth opposite such Underwriter&rsquo;s name in Schedule&nbsp;I hereto.</FONT></P> <P STYLE=""font: 10pt Times New Roman, Times, Serif; margin: 0pt 0; text-indent: 0.5in""><FONT STYLE=""font-size: 10pt"">&nbsp;</FONT></P> <P STYLE=""font: 10pt Times New Roman, Times, Serif; margin: 0pt 0; text-indent: 0.5in""><FONT STYLE=""font-size: 10pt"">(b)&nbsp;&nbsp;&nbsp;&nbsp;&nbsp;&nbsp;&nbsp;Subject to the terms and conditions and in reliance upon the representations and warranties herein set forth, the Company hereby grants an option to the several Unde"
1779474,000095010319010751,dp111173_ex0101.htm,sec_cache_light_fix/CIK1779474/000095010319010751/dp111173_ex0101.htm,purchase price,$0.350,"ion and the settlement date. The number of Optional Securities to be purchased by each Underwriter shall be based upon the same percentage of the total number of the Optional Securities to be purchased by the several Underwriters as such Underwriter is purchasing of the Firm Securities, subject to such adjustments as the Representative in its absolute discretion shall make to eliminate any fractional shares.</FONT></P> <P STYLE=""font: 10pt Times New Roman, Times, Serif; margin: 0pt 0; text-indent: 0.5in""><FONT STYLE=""font-size: 10pt"">&nbsp;</FONT></P> <P STYLE=""font: 10pt Times New Roman, Times, Serif; margin: 0pt 0; text-indent: 0.5in""><FONT STYLE=""font-size: 10pt"">(c)&nbsp;&nbsp;&nbsp;&nbs"
1779474,000095010319010751,dp111173_ex0101.htm,sec_cache_light_fix/CIK1779474/000095010319010751/dp111173_ex0101.htm,purchase price,"$245,000,000","vided for in Section&nbsp;3 hereof shall have been exercised on or before the second Business Day prior to the Closing Date) shall be made at 10:00 a.m., New York City time, on August 12, 2019, or at such time on such later date not more than three (3) Business Days after the foregoing date as the Representative shall designate, which date and time may be postponed by agreement between the Representative and the Company or as provided in Section&nbsp;9 hereof (such date and time of delivery and payment for the Offered Securities being herein called the &ldquo;<U>Closing Date</U>&rdquo;). Delivery of the Offered Securities shall be made to the Representative for the respective accounts of the"
