filer_cik10,accession_nodash,exhibit_file,path,matched_phrase,money_in_window,snippet
51143,000110465918071763,a18-41255_1ex99d2.htm,sec_cache_light_fix/CIK51143/000110465918071763/a18-41255_1ex99d2.htm,cash consideration,$1.8,"""2"" face=""Times New Roman"" style=""font-size:10.0pt;font-weight:bold;"">Financial Implications</font></b></p> <p style=""margin:0in 0in .0001pt;""><font size=""2"" face=""Times New Roman"" style=""font-size:10.0pt;"">&nbsp;</font></p> <p style=""margin:0in 0in .0001pt;""><font size=""2"" face=""Times New Roman"" style=""font-size:10.0pt;"">The transaction price is approximately $1.8 billion.&#160; IBM will receive cash consideration, with approximately half at the time of closing, and half within 12 months of closing.</font></p> <p style=""margin:0in 0in .0001pt;""><font size=""2"" face=""Times New Roman"" style=""font-size:10.0pt;"">&nbsp;</font></p> <p style=""margin:0in 0in .0001pt;""><font size=""2"" face=""Times New "
1101302,000119312504061482,dex101.htm,sec_cache_light_fix/CIK1101302/000119312504061482/dex101.htm,purchase price,"$15,000,000","tion of &#147;Acquisition Reduction&#148; is added, and shall read as follows: </FONT></P> <P STYLE=""margin-top:0px;margin-bottom:-6px""><FONT SIZE=""1"">&nbsp;</FONT></P> <P STYLE=""margin-top:0px;margin-bottom:0px; margin-left:8%; text-indent:4%""><FONT FACE=""Times New Roman"" SIZE=""2"">&#147;&#145;Acquisition Reduction&#146; means the amount of payments by the Borrower after February 17, 2004, of the purchase price of the ownership interests or assets of any other Person, which payments are attributed to goodwill or other intangible assets of the acquired Person, as such amount is certified to the Agent by the Borrower in a Certificate of Chief Financial Officer as to Fiscal Quarter Financial St"
65770,000119312519001180,d676446dex101.htm,sec_cache_light_fix/CIK65770/000119312519001180/d676446dex101.htm,Purchase Price,"$0.60|$1,200,000.00","V STYLE=""width:8.5in"" align=""left""> <P STYLE=""margin-top:0pt; margin-bottom:0pt; font-size:10pt; font-family:Times New Roman"" ALIGN=""center""><B>INVESTOR SIGNATURE PAGE </B></P> <P STYLE=""margin-top:12pt; margin-bottom:0pt; font-size:10pt; font-family:Times New Roman"">Number of Shares: <U>2,000,000</U> </P> <P STYLE=""margin-top:12pt; margin-bottom:0pt; font-size:10pt; font-family:Times New Roman"">Purchase Price Per Share: <U>$0.60</U> </P> <P STYLE=""margin-top:12pt; margin-bottom:0pt; font-size:10pt; font-family:Times New Roman"">Aggregate Purchase Price: <U>$1,200,000.00</U> </P> <P STYLE=""margin-top:12pt; margin-bottom:0pt; font-size:10pt; font-family:Times New Roman"">Please confirm that the"
65770,000119312519001180,d676446dex101.htm,sec_cache_light_fix/CIK65770/000119312519001180/d676446dex101.htm,Purchase Price,"$0.60|$1,200,000.00","INVESTOR SIGNATURE PAGE </B></P> <P STYLE=""margin-top:12pt; margin-bottom:0pt; font-size:10pt; font-family:Times New Roman"">Number of Shares: <U>2,000,000</U> </P> <P STYLE=""margin-top:12pt; margin-bottom:0pt; font-size:10pt; font-family:Times New Roman"">Purchase Price Per Share: <U>$0.60</U> </P> <P STYLE=""margin-top:12pt; margin-bottom:0pt; font-size:10pt; font-family:Times New Roman"">Aggregate Purchase Price: <U>$1,200,000.00</U> </P> <P STYLE=""margin-top:12pt; margin-bottom:0pt; font-size:10pt; font-family:Times New Roman"">Please confirm that the foregoing correctly sets forth the agreement between us by signing in the space provided below for that purpose. </P> <P STYLE=""margin-top:12pt"
65770,000119312516717872,d263921dex101.htm,sec_cache_light_fix/CIK65770/000119312516717872/d263921dex101.htm,Purchase Price,$1.50|$2.50,"t a price equal to $1.50 per share. Beginning one (1) Business Day following the Commencement Date, the Company shall have the right, but not the obligation, to direct the Investor, by its delivery to the Investor of a Regular Purchase Notice from time to time, to purchase up to One Hundred Fifty Thousand (150,000) Purchase Shares (each such purchase a &#147;<U>Regular Purchase</U>&#148;), at the Purchase Price on the Purchase Date; provided, however, that (i) the Regular Purchase may be increased to up to One Hundred Seventy-Five Thousand (175,000) Purchase Shares, provided that the Closing Sale Price of the Common Stock is not below $2.50 on the Purchase Date, (ii) the Regular Purchase may"
65770,000119312516717872,d263921dex101.htm,sec_cache_light_fix/CIK65770/000119312516717872/d263921dex101.htm,Purchase Price,"$1,000,000","ately adjusted for any reorganization, recapitalization, non-cash dividend, stock split or other similar transaction); and provided, further, that the Investor&#146;s committed obligation under any single Regular Purchase shall not exceed One Million Dollars ($1,000,000), unless the parties mutually agree to increase the dollar amount of any Regular Purchase on any Purchase Date at the applicable Purchase Price. If the Company delivers any Regular Purchase Notice for a Purchase Amount in excess of the limitations contained in the immediately preceding sentence, such Regular Purchase Notice shall be void <I>ab initio</I> to the extent of the amount by which the number of Purchase Shares set f"
65770,000119312516717872,d263921dex101.htm,sec_cache_light_fix/CIK65770/000119312516717872/d263921dex101.htm,Purchase Price,$1.00,"rms and conditions of this Agreement, in addition to purchases of Purchase Shares as described in Section 2(a) above, the Company shall also have the right, but not the obligation, to direct the Investor by the Company&#146;s delivery to the Investor of an Accelerated Purchase Notice from time to time, and the Investor thereupon shall have the obligation, to buy Purchase Shares at the Accelerated Purchase Price on the Accelerated Purchase Date in an amount equal to the Accelerated Purchase Share Amount (each such purchase, an &#147;<U>Accelerated Purchase</U>&#148;).&nbsp;The Company may deliver an Accelerated Purchase Notice to the Investor only on a Purchase Date on which the Closing Sale "
65770,000119312516717872,d263921dex101.htm,sec_cache_light_fix/CIK65770/000119312516717872/d263921dex101.htm,Purchase Price,$1.00,"e designate by written notice in accordance with the provisions of this Agreement. Whenever any amount expressed to be due by the terms of this Agreement is due on any day that is not a Business Day, the same shall instead be due on the next succeeding day that is a Business Day. </P> <P STYLE=""margin-top:12pt; margin-bottom:0pt; text-indent:8%; font-size:10pt; font-family:Times New Roman"">(d) <U>Purchase Price Floor.</U>&nbsp;The Company and the Investor shall not effect any Regular Purchase under this Agreement on any Purchase Date that the Closing Sale Price is less than the Floor Price. &#147;<U>Floor Price</U>&#148; means $1.00, which shall be appropriately adjusted for any reorganizati"
65770,000119312516800638,d287711dex101.htm,sec_cache_light_fix/CIK65770/000119312516800638/d287711dex101.htm,Purchase Price,"$1.07|$2,140,000.00","9999"" WIDTH=""100%"" ALIGN=""CENTER""> <P STYLE=""margin-top:0pt; margin-bottom:0pt; font-size:10pt; font-family:Times New Roman"" ALIGN=""center""><B>INVESTOR SIGNATURE PAGE </B></P> <P STYLE=""margin-top:12pt; margin-bottom:0pt; font-size:10pt; font-family:Times New Roman"">Number of Shares: <U>2,000,000</U> </P> <P STYLE=""margin-top:12pt; margin-bottom:0pt; font-size:10pt; font-family:Times New Roman"">Purchase Price Per Share: <U>$1.07</U> </P> <P STYLE=""margin-top:12pt; margin-bottom:0pt; font-size:10pt; font-family:Times New Roman"">Aggregate Purchase Price: <U>$2,140,000.00</U> </P> <P STYLE=""margin-top:12pt; margin-bottom:0pt; font-size:10pt; font-family:Times New Roman"">Please confirm that the "
65770,000119312516800638,d287711dex101.htm,sec_cache_light_fix/CIK65770/000119312516800638/d287711dex101.htm,Purchase Price,"$1.07|$2,140,000.00","INVESTOR SIGNATURE PAGE </B></P> <P STYLE=""margin-top:12pt; margin-bottom:0pt; font-size:10pt; font-family:Times New Roman"">Number of Shares: <U>2,000,000</U> </P> <P STYLE=""margin-top:12pt; margin-bottom:0pt; font-size:10pt; font-family:Times New Roman"">Purchase Price Per Share: <U>$1.07</U> </P> <P STYLE=""margin-top:12pt; margin-bottom:0pt; font-size:10pt; font-family:Times New Roman"">Aggregate Purchase Price: <U>$2,140,000.00</U> </P> <P STYLE=""margin-top:12pt; margin-bottom:0pt; font-size:10pt; font-family:Times New Roman"">Please confirm that the foregoing correctly sets forth the agreement between us by signing in the space provided below for that purpose. </P> <P STYLE=""margin-top:12pt"
78003,000091412109000324,pf11518635-ex2_1.txt,sec_cache_light_fix/CIK78003/000091412109000324/pf11518635-ex2_1.txt,Cash Consideration,$33.00,"on Stock issuable upon conversion of the Parent Convertible Preferred Stock and the Convertible Debentures, equals the Maximum Share Number) (the ""Stock Consideration"") and (ii) $33.00 in cash without interest plus, if the Exchange Ratio is adjusted pursuant to the preceding clause (i), the amount in cash equal to the Exchange Ratio Reduction Number multiplied by the Parent Share Cash Value (the ""Cash Consideration""). Together with any cash in lieu of fractional shares of Parent Common Stock to be paid pursuant to Section 2.5, the Stock Consideration and Cash Consideration are collectively referred to herein as the ""Common Stock Merger Consideration."" (c) At the Effective Time, by virtue of "
78003,000091412109000324,pf11518635-ex2_1.txt,sec_cache_light_fix/CIK78003/000091412109000324/pf11518635-ex2_1.txt,cash consideration,$750,"a) acquire (including, by merger, consolidation, or acquisition of stock, assets or any acquisition or license of Intellectual Property or any other business combination or collaboration) any interest in any corporation, partnership, other business organization or any division thereof or any assets or interest in any assets from any other Person, except for acquisitions and licenses for which the cash consideration paid prior to the Effective Time, together with the cash consideration paid prior to the Effective Time for any other such acquisitions or licenses, does not exceed $750 million in the aggregate; (b) merge or consolidate Parent with any Person or adopt a plan of complete or partia"
78003,000091412109000324,pf11518635-ex2_1.txt,sec_cache_light_fix/CIK78003/000091412109000324/pf11518635-ex2_1.txt,cash consideration,$750,"k, assets or any acquisition or license of Intellectual Property or any other business combination or collaboration) any interest in any corporation, partnership, other business organization or any division thereof or any assets or interest in any assets from any other Person, except for acquisitions and licenses for which the cash consideration paid prior to the Effective Time, together with the cash consideration paid prior to the Effective Time for any other such acquisitions or licenses, does not exceed $750 million in the aggregate; (b) merge or consolidate Parent with any Person or adopt a plan of complete or partial liquidation or resolutions providing for a complete or partial liquid"
72162,000117623603000004,nlform_10k2002ex10-49.txt,sec_cache_light_fix/CIK72162/000117623603000004/nlform_10k2002ex10-49.txt,Purchase  Price,$18.00|$18.00,"the purchase and sale of the Shares and Options, Seller hereby agrees and directs NL, and NL hereby agrees, that no certificates evidencing Shares acquired upon exercise of options shall be delivered to Seller, and NL shall not be required to issue any such Shares to Seller. Seller agrees that, promptly after execution of this Agreement, the Options shall be cancelled. Section 1.3. Purchase Price and Payment. NL hereby purchases the Sales from Seller for a purchase price in cash of $18.00 per Share, and hereby purchases the Options from Seller for a purchase price in cash of $18.00 per Option, less the applicable exercise price of such Option. Seller agrees that NL shall be entitled to deduc"
72162,000117623603000004,nlform_10k2002ex10-49.txt,sec_cache_light_fix/CIK72162/000117623603000004/nlform_10k2002ex10-49.txt,purchase  price,$18.00|$18.00,"ts NL, and NL hereby agrees, that no certificates evidencing Shares acquired upon exercise of options shall be delivered to Seller, and NL shall not be required to issue any such Shares to Seller. Seller agrees that, promptly after execution of this Agreement, the Options shall be cancelled. Section 1.3. Purchase Price and Payment. NL hereby purchases the Sales from Seller for a purchase price in cash of $18.00 per Share, and hereby purchases the Options from Seller for a purchase price in cash of $18.00 per Option, less the applicable exercise price of such Option. Seller agrees that NL shall be entitled to deduct from the purchase price all withholding amounts NL is required to pay in conn"
72162,000117623603000004,nlform_10k2002ex10-49.txt,sec_cache_light_fix/CIK72162/000117623603000004/nlform_10k2002ex10-49.txt,purchase  price,$18.00|$18.00,"shall be delivered to Seller, and NL shall not be required to issue any such Shares to Seller. Seller agrees that, promptly after execution of this Agreement, the Options shall be cancelled. Section 1.3. Purchase Price and Payment. NL hereby purchases the Sales from Seller for a purchase price in cash of $18.00 per Share, and hereby purchases the Options from Seller for a purchase price in cash of $18.00 per Option, less the applicable exercise price of such Option. Seller agrees that NL shall be entitled to deduct from the purchase price all withholding amounts NL is required to pay in connection with any exercise or sale of options by Seller as set forth on Schedule I. <PAGE> ARTICLE II. R"
72162,000117623603000004,nlform_10k2002ex10-49.txt,sec_cache_light_fix/CIK72162/000117623603000004/nlform_10k2002ex10-49.txt,purchase price,$18.00|$18.00,"ment, the Options shall be cancelled. Section 1.3. Purchase Price and Payment. NL hereby purchases the Sales from Seller for a purchase price in cash of $18.00 per Share, and hereby purchases the Options from Seller for a purchase price in cash of $18.00 per Option, less the applicable exercise price of such Option. Seller agrees that NL shall be entitled to deduct from the purchase price all withholding amounts NL is required to pay in connection with any exercise or sale of options by Seller as set forth on Schedule I. <PAGE> ARTICLE II. REPRESENTATIONS AND WARRANTIES OF THE SELLER Seller represents and warrants to NL as of the date of this Agreement as follows: Section 2.1. Authority. Sel"
72162,000117623603000004,nlform_10k2002ex10-48.txt,sec_cache_light_fix/CIK72162/000117623603000004/nlform_10k2002ex10-48.txt,Purchase Price,$18.00|$18.00,"the purchase and sale of the Shares and Options, Seller hereby agrees and directs NL, and NL hereby agrees, that no certificates evidencing Shares acquired upon exercise of options shall be delivered to Seller, and NL shall not be required to issue any such Shares to Seller. Seller agrees that, promptly after execution of this Agreement, the Options shall be cancelled. Section 1.3. Purchase Price and Payment. NL hereby purchases the Shares from Seller for a purchase price in cash of $18.00 per Share, and hereby purchases the Options from Seller for a purchase price in cash of $18.00 per Option, less the applicable exercise price of such Option. Seller agrees that NL shall be entitled to dedu"
72162,000117623603000004,nlform_10k2002ex10-48.txt,sec_cache_light_fix/CIK72162/000117623603000004/nlform_10k2002ex10-48.txt,purchase  price,$18.00|$18.00,"ts NL, and NL hereby agrees, that no certificates evidencing Shares acquired upon exercise of options shall be delivered to Seller, and NL shall not be required to issue any such Shares to Seller. Seller agrees that, promptly after execution of this Agreement, the Options shall be cancelled. Section 1.3. Purchase Price and Payment. NL hereby purchases the Shares from Seller for a purchase price in cash of $18.00 per Share, and hereby purchases the Options from Seller for a purchase price in cash of $18.00 per Option, less the applicable exercise price of such Option. Seller agrees that NL shall be entitled to deduct from the purchase price all withholding amounts NL is required to pay in con"
72162,000117623603000004,nlform_10k2002ex10-48.txt,sec_cache_light_fix/CIK72162/000117623603000004/nlform_10k2002ex10-48.txt,purchase  price,$18.00|$18.00,"shall be delivered to Seller, and NL shall not be required to issue any such Shares to Seller. Seller agrees that, promptly after execution of this Agreement, the Options shall be cancelled. Section 1.3. Purchase Price and Payment. NL hereby purchases the Shares from Seller for a purchase price in cash of $18.00 per Share, and hereby purchases the Options from Seller for a purchase price in cash of $18.00 per Option, less the applicable exercise price of such Option. Seller agrees that NL shall be entitled to deduct from the purchase price all withholding amounts NL is required to pay in connection with any exercise or sale of options by Seller as set forth on Schedule I. <PAGE> ARTICLE II. "
72162,000117623603000004,nlform_10k2002ex10-48.txt,sec_cache_light_fix/CIK72162/000117623603000004/nlform_10k2002ex10-48.txt,purchase price,$18.00|$18.00,"ment, the Options shall be cancelled. Section 1.3. Purchase Price and Payment. NL hereby purchases the Shares from Seller for a purchase price in cash of $18.00 per Share, and hereby purchases the Options from Seller for a purchase price in cash of $18.00 per Option, less the applicable exercise price of such Option. Seller agrees that NL shall be entitled to deduct from the purchase price all withholding amounts NL is required to pay in connection with any exercise or sale of options by Seller as set forth on Schedule I. <PAGE> ARTICLE II. REPRESENTATIONS AND WARRANTIES OF THE SELLER Seller represents and warrants to NL as of the date of this Agreement as follows: Section 2.1. Authority. Se"
72162,000117623603000004,nlform_10k2002ex10-46.txt,sec_cache_light_fix/CIK72162/000117623603000004/nlform_10k2002ex10-46.txt,Purchase  Price,$18.00|$18.00,"the purchase and sale of the Shares and Options, Seller hereby agrees and directs NL, and NL hereby agrees, that no certificates evidencing Shares acquired upon exercise of options shall be delivered to Seller, and NL shall not be required to issue any such Shares to Seller. Seller agrees that, promptly after execution of this Agreement, the Options shall be cancelled. Section 1.3. Purchase Price and Payment. NL hereby purchases the Sales from Seller for a purchase price in cash of $18.00 per Share, and hereby purchases the Options from Seller for a purchase price in cash of $18.00 per Option, less the applicable exercise price of such Option. Seller agrees that NL shall be entitled to deduc"
72162,000117623603000004,nlform_10k2002ex10-46.txt,sec_cache_light_fix/CIK72162/000117623603000004/nlform_10k2002ex10-46.txt,purchase  price,$18.00|$18.00,"ts NL, and NL hereby agrees, that no certificates evidencing Shares acquired upon exercise of options shall be delivered to Seller, and NL shall not be required to issue any such Shares to Seller. Seller agrees that, promptly after execution of this Agreement, the Options shall be cancelled. Section 1.3. Purchase Price and Payment. NL hereby purchases the Sales from Seller for a purchase price in cash of $18.00 per Share, and hereby purchases the Options from Seller for a purchase price in cash of $18.00 per Option, less the applicable exercise price of such Option. Seller agrees that NL shall be entitled to deduct from the purchase price all withholding amounts NL is required to pay in conn"
72162,000117623603000004,nlform_10k2002ex10-46.txt,sec_cache_light_fix/CIK72162/000117623603000004/nlform_10k2002ex10-46.txt,purchase  price,$18.00|$18.00,"shall be delivered to Seller, and NL shall not be required to issue any such Shares to Seller. Seller agrees that, promptly after execution of this Agreement, the Options shall be cancelled. Section 1.3. Purchase Price and Payment. NL hereby purchases the Sales from Seller for a purchase price in cash of $18.00 per Share, and hereby purchases the Options from Seller for a purchase price in cash of $18.00 per Option, less the applicable exercise price of such Option. Seller agrees that NL shall be entitled to deduct from the purchase price all withholding amounts NL is required to pay in connection with any exercise or sale of options by Seller as set forth on Schedule I. <PAGE> ARTICLE II. R"
72162,000117623603000004,nlform_10k2002ex10-46.txt,sec_cache_light_fix/CIK72162/000117623603000004/nlform_10k2002ex10-46.txt,purchase price,$18.00|$18.00,"ment, the Options shall be cancelled. Section 1.3. Purchase Price and Payment. NL hereby purchases the Sales from Seller for a purchase price in cash of $18.00 per Share, and hereby purchases the Options from Seller for a purchase price in cash of $18.00 per Option, less the applicable exercise price of such Option. Seller agrees that NL shall be entitled to deduct from the purchase price all withholding amounts NL is required to pay in connection with any exercise or sale of options by Seller as set forth on Schedule I. <PAGE> ARTICLE II. REPRESENTATIONS AND WARRANTIES OF THE SELLER Seller represents and warrants to NL as of the date of this Agreement as follows: Section 2.1. Authority. Sel"
72162,000117623603000004,nlform_10k2002ex10-47.txt,sec_cache_light_fix/CIK72162/000117623603000004/nlform_10k2002ex10-47.txt,Purchase  Price,$18.00|$18.00,"the purchase and sale of the Shares and Options, Seller hereby agrees and directs NL, and NL hereby agrees, that no certificates evidencing Shares acquired upon exercise of options shall be delivered to Seller, and NL shall not be required to issue any such Shares to Seller. Seller agrees that, promptly after execution of this Agreement, the Options shall be cancelled. Section 1.3. Purchase Price and Payment. NL hereby purchases the Sales from Seller for a purchase price in cash of $18.00 per Share, and hereby purchases the Options from Seller for a purchase price in cash of $18.00 per Option, less the applicable exercise price of such Option. Seller agrees that NL shall be entitled to deduc"
72162,000117623603000004,nlform_10k2002ex10-47.txt,sec_cache_light_fix/CIK72162/000117623603000004/nlform_10k2002ex10-47.txt,purchase  price,$18.00|$18.00,"ts NL, and NL hereby agrees, that no certificates evidencing Shares acquired upon exercise of options shall be delivered to Seller, and NL shall not be required to issue any such Shares to Seller. Seller agrees that, promptly after execution of this Agreement, the Options shall be cancelled. Section 1.3. Purchase Price and Payment. NL hereby purchases the Sales from Seller for a purchase price in cash of $18.00 per Share, and hereby purchases the Options from Seller for a purchase price in cash of $18.00 per Option, less the applicable exercise price of such Option. Seller agrees that NL shall be entitled to deduct from the purchase price all withholding amounts NL is required to pay in conn"
72162,000117623603000004,nlform_10k2002ex10-47.txt,sec_cache_light_fix/CIK72162/000117623603000004/nlform_10k2002ex10-47.txt,purchase  price,$18.00|$18.00,"shall be delivered to Seller, and NL shall not be required to issue any such Shares to Seller. Seller agrees that, promptly after execution of this Agreement, the Options shall be cancelled. Section 1.3. Purchase Price and Payment. NL hereby purchases the Sales from Seller for a purchase price in cash of $18.00 per Share, and hereby purchases the Options from Seller for a purchase price in cash of $18.00 per Option, less the applicable exercise price of such Option. Seller agrees that NL shall be entitled to deduct from the purchase price all withholding amounts NL is required to pay in connection with any exercise or sale of options by Seller as set forth on Schedule I. <PAGE> ARTICLE II. R"
72162,000117623603000004,nlform_10k2002ex10-47.txt,sec_cache_light_fix/CIK72162/000117623603000004/nlform_10k2002ex10-47.txt,purchase price,$18.00|$18.00,"ment, the Options shall be cancelled. Section 1.3. Purchase Price and Payment. NL hereby purchases the Sales from Seller for a purchase price in cash of $18.00 per Share, and hereby purchases the Options from Seller for a purchase price in cash of $18.00 per Option, less the applicable exercise price of such Option. Seller agrees that NL shall be entitled to deduct from the purchase price all withholding amounts NL is required to pay in connection with any exercise or sale of options by Seller as set forth on Schedule I. <PAGE> ARTICLE II. REPRESENTATIONS AND WARRANTIES OF THE SELLER Seller represents and warrants to NL as of the date of this Agreement as follows: Section 2.1. Authority. Sel"
31462,000110465908069367,a08-28035_1ex10d1.htm,sec_cache_light_fix/CIK31462/000110465908069367/a08-28035_1ex10d1.htm,"Purchase
Price","$300,000,000","le=""color:black;margin:0in 0in .0001pt .5in;text-indent:1.75in;""><font size=""2"" color=""black"" face=""Times New Roman"">&nbsp;</font></p> <p style=""color:black;margin:0in 0in .0001pt .5in;text-indent:1.75in;""><font size=""2"" color=""black"" face=""Times New Roman"" style=""font-size:10.0pt;"">(ii)&#160;&#160; <i>Purchase Price</i>.&#160; The purchase price for the First Purchased Shares shall be the First Purchase Price, which shall not be less than $300,000,000.</font></p> <p style=""color:black;margin:0in 0in .0001pt .5in;text-indent:1.75in;""><font size=""2"" color=""black"" face=""Times New Roman"">&nbsp;</font></p> <p style=""color:black;margin:0in 0in .0001pt .5in;text-indent:1.75in;""><font size=""2"" colo"
